Type,Paper ID,Oral / Poster,Track Theme,Title,Authors Names,Presenter first name,Presenter last name,Session,Sub-session,Session Time
Main,1103,VPoster,NLP Applications,Multi-pass Decoding for Grammatical Error Correction,"Xiaoying Wang(~Xiaoying_Wang2),Lingling Mu(~Lingling_Mu1),Jingyi Zhang(~Jingyi_Zhang5),Hongfei Xu(~Hongfei_Xu2)",Xiaoying,Wang,VPoster,,
Main,1104,Poster,Human-centered NLP,Into the Unknown Unknowns: Engaged Human Learning through Participation in Language Model Agent Conversations,"Yucheng Jiang(~Yucheng_Jiang3),Yijia Shao(~Yijia_Shao1),Dekun Ma(~Dekun_Ma1),Sina Semnani(~Sina_Semnani1),Monica Lam(~Monica_Lam1)",Yucheng,Jiang,Session 06,Human-centered NLP 2,Nov 13 (Wed) 10:30-12:00
Main,1114,Poster,Language Modeling,SCOI: Syntax-augmented Coverage-based In-context Example Selection for Machine Translation,"Chenming Tang(~Chenming_Tang1),Zhixiang Wang(~Zhixiang_Wang5),Yunfang Wu(~Yunfang_Wu1)",Chenming,Tang,Session 03,Language Modeling 2,Nov 12 (Tue) 14:00-15:30
Main,1115,Poster,"Multimodality and Language Grounding to Vision, Robotics and Beyond",Efficient Temporal Extrapolation of Multimodal Large Language Models with Temporal Grounding Bridge,"Yuxuan Wang(~Yuxuan_Wang4),Yueqian Wang(~Yueqian_Wang1),Pengfei Wu(~Pengfei_Wu6),Jianxin Liang(~Jianxin_Liang1),Dongyan Zhao(~Dongyan_Zhao2),Yang Liu(~Yang_Liu20),Zilong Zheng(~Zilong_Zheng1)",Yuxuan,Wang,Session 09,"Multimodality and Language Grounding to Vision, Robotics and Beyond 4",Nov 13 (Wed) 16:00-17:30
Main,1118,Oral,Summarization,STORYSUMM: Evaluating Faithfulness in Story Summarization,"Melanie Subbiah(~Melanie_Subbiah1),Faisal Ladhak(~Faisal_Ladhak2),Akankshya Mishra(~Akankshya_Mishra3),Griffin Thomas Adams(~Griffin_Thomas_Adams1),Lydia Chilton(~Lydia_Chilton1),Kathleen McKeown(~Kathleen_McKeown1)",Melanie,Subbiah,Session 03,Generation and Summarization,Nov 12 (Tue) 14:00-15:30
Main,1119,Poster,"Multimodality and Language Grounding to Vision, Robotics and Beyond",MMOE: Enhancing Multimodal Models with Mixtures of Multimodal Interaction Experts,"Haofei Yu(~Haofei_Yu1),Zhengyang Qi(~Zhengyang_Qi1),Lawrence Keunho Jang(~Lawrence_Keunho_Jang1),Russ Salakhutdinov(~Russ_Salakhutdinov1),Louis-Philippe Morency(~Louis-Philippe_Morency1),Paul Pu Liang(~Paul_Pu_Liang1)",TBA,TBA,Session 02,"Multimodality and Language Grounding to Vision, Robotics and Beyond 1",Nov 12 (Tue) 11:00-12:30
Main,1121,Poster,"Multimodality and Language Grounding to Vision, Robotics and Beyond",OmAgent: A Multi-modal Agent Framework for Complex Video Understanding with Task Divide-and-Conquer,"Lu Zhang(~Lu_Zhang23),Tiancheng Zhao(~Tiancheng_Zhao1),Heting Ying(~Heting_Ying1),Yibo Ma(~Yibo_Ma2),Kyusong Lee(~Kyusong_Lee2)",Tiancheng,Zhao,Session 02,"Multimodality and Language Grounding to Vision, Robotics and Beyond 1",Nov 12 (Tue) 11:00-12:30
Main,1127,Poster,Generation,Enhancing Pre-Trained Generative Language Models with Question Attended Span Extraction on Machine Reading Comprehension,"Lin Ai(~Lin_Ai1),Zheng Hui(~Zheng_Hui2),Zizhou Liu(~Zizhou_Liu1),Julia Hirschberg(~Julia_Hirschberg1)",Lin,Ai,Session 02,Generation 1,Nov 12 (Tue) 11:00-12:30
Main,1128,VPoster,NLP Applications,CommonIT: Commonality-Aware Instruction Tuning for Large Language Models via Data Partitions,"Jun Rao(~Jun_Rao1),Xuebo Liu(~Xuebo_Liu1),Lian Lian(~Lian_Lian3),shengjun cheng(~shengjun_cheng1),Yunjie Liao(~Yunjie_Liao1),Min Zhang(~Min_Zhang9)",Jun,Rao,VPoster,,
Main,1130,Poster,Speech Processing and Spoken Language Understanding,ESC: Efficient Speech Coding with Cross-Scale Residual Vector Quantized Transformers,"Yuzhe Gu(~Yuzhe_Gu2),Enmao Diao(~Enmao_Diao1)",Yuzhe,Gu,Session 06,Speech Processing and Spoken Language Understanding 1,Nov 13 (Wed) 10:30-12:00
Main,1132,Poster,"Special Theme: Efficiency in Model Algorithms, Training, and Inference",Breaking ReLU Barrier: Generalized MoEfication for Dense Pretrained Models,"Jaeseong Lee(~Jaeseong_Lee1),seung-won hwang(~seung-won_hwang2),Wonpyo Park(~Wonpyo_Park1),Mingi Ji(~Mingi_Ji1)",TBA,TBA,Session 04,"Special Theme: Efficiency in Model Algorithms, Training, and Inference 2",Nov 12 (Tue) 16:00-17:30
Main,1135,Poster,"Linguistic Theories, Cognitive Modeling and Psycholinguistics",Detecting Subtle Differences between Human and Model Languages Using Spectrum of Relative Likelihood,"Yang Xu(~Yang_Xu6),Yu Wang(~Yu_Wang65),Hao An(~Hao_An1),Yongyuan Li(~Yongyuan_Li1),Zhichen Liu(~Zhichen_Liu1)",Yu,Wang,Session 02,"Linguistic Theories, Cognitive Modeling and Psycholinguistics 1",Nov 12 (Tue) 11:00-12:30
Main,1136,VPoster,Machine Learning for NLP,Optimizing Language Models with Fair and Stable Reward Composition in Reinforcement Learning,"Jiahui Li(~Jiahui_Li2),Hanlin Zhang(~Hanlin_Zhang4),Fengda Zhang(~Fengda_Zhang1),Tai-Wei Chang(~Tai-Wei_Chang1),Kun Kuang(~Kun_Kuang1),Long Chen(~Long_Chen8),JUN ZHOU(~JUN_ZHOU6)",Jiahui,Li,VPoster,,
Main,1137,VPoster,"Ethics, Bias, and Fairness",Fine-grained Pluggable Gradient Ascent for Knowledge Unlearning in Language Models,"XiaoHua Feng(~XiaoHua_Feng3),Chaochao Chen(~Chaochao_Chen3),Yuyuan Li(~Yuyuan_Li1),Zibin Lin(~Zibin_Lin1)",Xiaohua,Feng,VPoster,,
Main,1138,Poster,NLP Applications,ARM: An Alignment-and-Replacement Module for Chinese Spelling Check Based on LLMs,"Changchun Liu(~Changchun_Liu2),Kai Zhang(~Kai_Zhang12),Junzhe Jiang(~Junzhe_Jiang3),Zirui Liu(~Zirui_Liu5),Hanqing Tao(~Hanqing_Tao1),Min Gao(~Min_Gao3),Enhong Chen(~Enhong_Chen1)",Changchun,Liu,Session 02,NLP Applications 1,Nov 12 (Tue) 11:00-12:30
Main,1140,VPoster,Interpretability and Analysis of Models for NLP,On the In-context Generation of Language Models,"Zhongtao Jiang(~Zhongtao_Jiang1),Yuanzhe Zhang(~Yuanzhe_Zhang1),Kun Luo(~Kun_Luo2),Xiaowei Yuan(~Xiaowei_Yuan1),Jun Zhao(~Jun_Zhao4),Kang Liu(~Kang_Liu1)",Zhongtao,Jiang,VPoster,,
Main,1141,Poster,Interpretability and Analysis of Models for NLP,Atomic Inference for NLI with Generated Facts as Atoms,"Joe Stacey(~Joe_Stacey1),Pasquale Minervini(~Pasquale_Minervini4),Haim Dubossarsky(~Haim_Dubossarsky1),Oana-Maria Camburu(~Oana-Maria_Camburu2),Marek Rei(~Marek_Rei1)",Joe,Stacey,Session 11,Interpretability and Analysis of Models for NLP 5,Nov 14 (Thu) 10:30-12:00
Main,1142,Poster,Speech Processing and Spoken Language Understanding,Towards Robust Speech Representation Learning for Thousands of Languages,"William Chen(~William_Chen2),Wangyou Zhang(~Wangyou_Zhang1),Yifan Peng(~Yifan_Peng6),Xinjian Li(~Xinjian_Li2),Jinchuan Tian(~Jinchuan_Tian1),Jiatong Shi(~Jiatong_Shi1),Xuankai Chang(~Xuankai_Chang1),Soumi Maiti(~Soumi_Maiti1),Karen Livescu(~Karen_Livescu1),Shinji Watanabe(~Shinji_Watanabe1)",William,Chen,Session 06,Speech Processing and Spoken Language Understanding 1,Nov 13 (Wed) 10:30-12:00
Main,1144,Poster,Interpretability and Analysis of Models for NLP,I Learn Better If You Speak My Language: Understanding the Superior Performance of Fine-Tuning Large Language Models with LLM-Generated Responses,"Xuan Ren(~Xuan_Ren1),Biao Wu(~Biao_Wu1),Lingqiao Liu(~Lingqiao_Liu3)",Xuan,Ren,Session 11,Interpretability and Analysis of Models for NLP 5,Nov 14 (Thu) 10:30-12:00
Main,1145,VPoster,Multilinguality and Language Diversity,PreAlign: Boosting Cross-Lingual Transfer by Early Establishment of Multilingual Alignment,"Jiahuan Li(~Jiahuan_Li1),Shujian Huang(~Shujian_Huang1),Aarron Ching(~Aarron_Ching1),Xinyu Dai(~Xinyu_Dai1),Jiajun Chen(~Jiajun_Chen1)",Jiahuan,Li,VPoster,,
Main,1150,Oral,Resources and Evaluation,"An image speaks a thousand words, but can everyone listen? On image transcreation for cultural relevance","Simran Khanuja(~Simran_Khanuja1),Sathyanarayanan Ramamoorthy(~Sathyanarayanan_Ramamoorthy1),Yueqi Song(~Yueqi_Song1),Graham Neubig(~Graham_Neubig1)",Simran,Khanuja,Session 09,Resources and Evaluation 4,Nov 13 (Wed) 16:00-17:30
Main,1162,Poster,Interpretability and Analysis of Models for NLP,When Parts are Greater Than Sums: Individual LLM Components Can Outperform Full Models,"Ting-Yun Chang(~Ting-Yun_Chang1),Jesse Thomason(~Jesse_Thomason1),Robin Jia(~Robin_Jia1)",Ting-Yun,Chang,Session 03,Interpretability and Analysis of Models for NLP 2,Nov 12 (Tue) 14:00-15:30
Main,1163,VPoster,Computational Social Science and Cultural Analytics,Multimodal Clickbait Detection by De-confounding Biases Using Causal Representation Inference,"Jianxing Yu(~Jianxing_Yu2),Shiqi Wang(~Shiqi_Wang3),Han Yin(~Han_Yin1),Zhenlong Sun(~Zhenlong_Sun1),Ruobing Xie(~Ruobing_Xie2),Bo zhang(~Bo_zhang32),Yanghui Rao(~Yanghui_Rao2)",Shiqi,Wang,VPoster,,
Main,1167,Poster,Information Retrieval and Text Mining,Matryoshka-Adaptor: Unsupervised and Supervised Tuning for Smaller Embedding Dimensions,"Jinsung Yoon(~Jinsung_Yoon1),Rajarishi Sinha(~Rajarishi_Sinha1),Sercan O Arik(~Sercan_O_Arik1),Tomas Pfister(~Tomas_Pfister1)",Jinsung,Yoon,Session 02,Information Retrieval and Text Mining 1,Nov 12 (Tue) 11:00-12:30
Main,1168,VPoster,Language Modeling,KNN-Instruct: Automatic Instruction Construction with K Nearest Neighbor Deduction,"Jianshang Kou(~Jianshang_Kou1),Benfeng Xu(~Benfeng_Xu1),Chiwei Zhu(~Chiwei_Zhu1),Zhendong Mao(~Zhendong_Mao1)",Jianshang,Kou,VPoster,,
Main,1170,Poster,Machine Learning for NLP,Contextualized Sequence Likelihood: Enhanced Confidence Scores for Natural Language Generation,"Zhen Lin(~Zhen_Lin2),Shubhendu Trivedi(~Shubhendu_Trivedi2),Jimeng Sun(~Jimeng_Sun3)",Zhen,Lin,Session 03,Machine Learning for NLP 1,Nov 12 (Tue) 14:00-15:30
Main,1173,Poster,Information Retrieval and Text Mining,$\texttt{MixGR}$: Enhancing Retriever Generalization for Scientific Domain through Complementary Granularity,"Fengyu Cai(~Fengyu_Cai1),Xinran Zhao(~Xinran_Zhao1),Tong Chen(~Tong_Chen3),Sihao Chen(~Sihao_Chen1),Hongming Zhang(~Hongming_Zhang2),Iryna Gurevych(~Iryna_Gurevych1),Heinz Koeppl(~Heinz_Koeppl1)",Fengyu,Cai,Session 02,Information Retrieval and Text Mining 1,Nov 12 (Tue) 11:00-12:30
Main,1175,Poster,NLP Applications,CARER - ClinicAl Reasoning-Enhanced Representation for Temporal Health Risk Prediction,"Tuan Dung Nguyen(~Tuan_Dung_Nguyen2),Thanh Trung Huynh(~Thanh_Trung_Huynh1),Minh Hieu Phan(~Minh_Hieu_Phan1),Quoc Viet Hung Nguyen(~Quoc_Viet_Hung_Nguyen1),Phi Le Nguyen(~Phi_Le_Nguyen2)",Tuan Dung,Nguyen,Session 02,NLP Applications 1,Nov 12 (Tue) 11:00-12:30
Main,1179,Poster,Dialogue and Interactive Systems,"""In-Dialogues We Learn"": Towards Personalized Dialogue Without Pre-defined Profiles through In-Dialogue Learning","Chuanqi Cheng(~Chuanqi_Cheng1),Quan Tu(~Quan_Tu2),Wei Wu(~Wei_Wu1),Shuo Shang(~Shuo_Shang1),Cunli Mao(~Cunli_Mao1),Zhengtao Yu(~Zhengtao_Yu2),Rui Yan(~Rui_Yan2)",Chuanqi,Cheng,Session 09,Dialogue and Interactive Systems 2,Nov 13 (Wed) 16:00-17:30
Main,1183,Poster,Interpretability and Analysis of Models for NLP,Encourage or Inhibit Monosemanticity? Revisit Monosemanticity from a Feature Decorrelation Perspective,"Hanqi Yan(~Hanqi_Yan2),Yanzheng Xiang(~Yanzheng_Xiang2),Guangyi Chen(~Guangyi_Chen1),Yifei Wang(~Yifei_Wang1),Lin Gui(~Lin_Gui3),Yulan He(~Yulan_He1)",Hanqi,Yan,Session 03,Interpretability and Analysis of Models for NLP 2,Nov 12 (Tue) 14:00-15:30
Main,1184,Poster,Generation,Enhancing Language Model Factuality via Activation-Based Confidence Calibration and Guided Decoding,"Xin Liu(~Xin_Liu18),Farima Fatahi Bayat(~Farima_Fatahi_Bayat1),Lu Wang(~Lu_Wang9)",Xin,Liu,Session 11,Generation 2,Nov 14 (Thu) 10:30-12:00
Main,1185,Poster,Resources and Evaluation,Reasoning Robustness of LLMs to Adversarial Typographical Errors,"Esther Gan(~Esther_Gan1),Yiran Zhao(~Yiran_Zhao2),Liying Cheng(~Liying_Cheng1),Mao Yancan(~Mao_Yancan1),Anirudh Goyal(~Anirudh_Goyal1),Kenji Kawaguchi(~Kenji_Kawaguchi1),Min-Yen Kan(~Min-Yen_Kan1),Michael Shieh(~Michael_Shieh1)",ESTHER,GAN,Session 04,Resources and Evaluation 2,Nov 12 (Tue) 16:00-17:30
Main,1186,VPoster,Language Modeling,InferAligner: Inference-Time Alignment for Harmlessness through Cross-Model Guidance,"Pengyu Wang(~Pengyu_Wang2),Dong Zhang(~Dong_Zhang9),Linyang Li(~Linyang_Li1),Chenkun Tan(~Chenkun_Tan1),Xinghao Wang(~Xinghao_Wang1),Mozhi Zhang(~Mozhi_Zhang2),Ke Ren(~Ke_Ren2),Botian Jiang(~Botian_Jiang1),Xipeng Qiu(~Xipeng_Qiu1)",Pengyu,Wang,VPoster,,
Main,1188,Poster,Resources and Evaluation,Belief Revision: The Adaptability of Large Language Models Reasoning,"Bryan Wilie(~Bryan_Wilie1),Samuel Cahyawijaya(~Samuel_Cahyawijaya1),Etsuko Ishii(~Etsuko_Ishii1),Junxian He(~Junxian_He1),Pascale Fung(~Pascale_Fung1)",Bryan,Wilie,Session 06,Resources and Evaluation 3,Nov 13 (Wed) 10:30-12:00
Main,1189,Poster,Low-resource Methods for NLP,Fisher Information-based Efficient Curriculum Federated Learning with Large Language Models,"Ji Liu(~Ji_Liu8),Jiaxiang Ren(~Jiaxiang_Ren1),Ruoming Jin(~Ruoming_Jin1),Zijie Zhang(~Zijie_Zhang1),Yang Zhou(~Yang_Zhou4),Patrick Valduriez(~Patrick_Valduriez2),Dejing Dou(~Dejing_Dou4)",Ji,Liu,Session 06,Low-resource Methods for NLP 2,Nov 13 (Wed) 10:30-12:00
Main,1191,Poster,NLP Applications,Bio-RFX: Refining Biomedical Extraction via Advanced Relation Classification and Structural Constraints,"Minjia Wang(~Minjia_Wang1),Fangzhou Liu(~Fangzhou_Liu1),Xiuxing Li(~Xiuxing_Li1),Bowen Dong(~Bowen_Dong2),Zhenyu Li(~Zhenyu_Li5),Tengyu Pan(~Tengyu_Pan1),Jianyong Wang(~Jianyong_Wang2)",Minjia,Wang,Session 02,NLP Applications 1,Nov 12 (Tue) 11:00-12:30
Main,1192,Poster,Information Retrieval and Text Mining,Decoding Matters: Addressing Amplification Bias and Homogeneity Issue in Recommendations for Large Language Models,"Keqin Bao(~Keqin_Bao1),Jizhi Zhang(~Jizhi_Zhang1),Yang Zhang(~Yang_Zhang24),Xinyue Huo(~Xinyue_Huo1),Chong Chen(~Chong_Chen6),Fuli Feng(~Fuli_Feng1)",TBA,TBA,Session 02,Information Retrieval and Text Mining 1,Nov 12 (Tue) 11:00-12:30
Main,1193,Poster,Interpretability and Analysis of Models for NLP,LLMs Are Prone to Fallacies in Causal Inference,"Nitish Joshi(~Nitish_Joshi1),Abulhair Saparov(~Abulhair_Saparov1),Yixin Wang(~Yixin_Wang1),He He(~He_He2)",Nitish,Joshi,Session 06,Interpretability and Analysis of Models for NLP 3,Nov 13 (Wed) 10:30-12:00
Main,1194,Poster,Human-centered NLP,Roleplay-doh: Enabling Domain-Experts to Create LLM-simulated Patients via Eliciting and Adhering to Principles,"Ryan Louie(~Ryan_Louie1),Ananjan Nandi(~Ananjan_Nandi1),William Fang(~William_Fang1),Cheng Chang(~Cheng_Chang5),Emma Brunskill(~Emma_Brunskill2),Diyi Yang(~Diyi_Yang2)",TBA,TBA,Session 06,Human-centered NLP 2,Nov 13 (Wed) 10:30-12:00
Main,1195,Poster,Computational Social Science and Cultural Analytics,The Lou Dataset - Exploring the Impact of Gender-Fair Language in German Text Classification,"Andreas Waldis(~Andreas_Waldis1),Joel Birrer(~Joel_Birrer1),Anne Lauscher(~Anne_Lauscher1),Iryna Gurevych(~Iryna_Gurevych1)",Andreas,Waldis,Session 12,Computational Social Science and Cultural Analytics 4,Nov 14 (Thu) 14:00-15:30
Main,1200,VPoster,"Syntax: Tagging, Chunking and Parsing",When Generative Adversarial Networks Meet Sequence Labeling Challenges,"Yu Tong(~Yu_Tong1),Ge Chen(~Ge_Chen2),Guokai Zheng(~Guokai_Zheng2),Rui Li(~Rui_Li23),Jiang Dazhi(~Jiang_Dazhi1)",Yu,Tong,VPoster,,
Main,1201,Oral,Question Answering,Evidence-Focused Fact Summarization for Knowledge-Augmented Zero-Shot Question Answering,"Sungho Ko(~Sungho_Ko1),Hyunjin Cho(~Hyunjin_Cho1),Hyungjoo Chae(~Hyungjoo_Chae1),Jinyoung Yeo(~Jinyoung_Yeo1),Dongha Lee(~Dongha_Lee1)",Sung-ho,Ko,Session 06,Question Answering 2,Nov 13 (Wed) 10:30-12:00
Main,1202,Poster,Resources and Evaluation,Speechworthy Instruction-tuned Language Models,"Hyundong Justin Cho(~Hyundong_Justin_Cho1),Nicolaas Paul Jedema(~Nicolaas_Paul_Jedema1),Leonardo F. R. Ribeiro(~Leonardo_F._R._Ribeiro1),Karishma Sharma(~Karishma_Sharma1),Pedro Szekely(~Pedro_Szekely1),Alessandro Moschitti(~Alessandro_Moschitti2),Ruben Janssen(~Ruben_Janssen1),Jonathan May(~Jonathan_May1)",Hyundong,Cho,Session 06,Resources and Evaluation 3,Nov 13 (Wed) 10:30-12:00
Main,1205,Oral,Language Modeling,"Data, Data Everywhere: A Guide for Pretraining Dataset Construction","Jupinder Parmar(~Jupinder_Parmar1),Shrimai Prabhumoye(~Shrimai_Prabhumoye1),Joseph Jennings(~Joseph_Jennings1),Bo Liu(~Bo_Liu24),Aastha Jhunjhunwala(~Aastha_Jhunjhunwala1),Zhilin Wang(~Zhilin_Wang2),Mostofa Patwary(~Mostofa_Patwary1),Mohammad Shoeybi(~Mohammad_Shoeybi1),Bryan Catanzaro(~Bryan_Catanzaro1)",Jupinder,Parmar,Session 11,Language Modeling 4,Nov 14 (Thu) 10:30-12:00
Main,1210,Oral,Machine Learning for NLP,Fine-Tuning and Prompt Optimization: Two Good Steps that Work Better Together,"Dilara Soylu(~Dilara_Soylu1),Christopher Potts(~Christopher_Potts1),Omar Khattab(~Omar_Khattab1)",Dilara,Soylu,Session 12,Machine Learning for NLP 4,Nov 14 (Thu) 14:00-15:30
Main,1213,Poster,Interpretability and Analysis of Models for NLP,Demystifying Verbatim Memorization in Large Language Models,"Jing Huang(~Jing_Huang2),Diyi Yang(~Diyi_Yang2),Christopher Potts(~Christopher_Potts1)",Jing,Huang,Session 03,Interpretability and Analysis of Models for NLP 2,Nov 12 (Tue) 14:00-15:30
Main,1216,Poster,Resources and Evaluation,AmbigNLG: Addressing Task Ambiguity in Instruction for NLG,"Ayana Niwa(~Ayana_Niwa1),Hayate Iso(~Hayate_Iso1)",Ayana,Niwa,Session 04,Resources and Evaluation 2,Nov 12 (Tue) 16:00-17:30
Main,1223,Poster,"Phonology, Morphology, and Word Segmentation",Distributional Properties of Subword Regularization,"Marco Cognetta(~Marco_Cognetta1),Vilém Zouhar(~Vilém_Zouhar1),Naoaki Okazaki(~Naoaki_Okazaki2)",Marco,Cognetta,Session 03,Discourse + Phonology + Syntax 1,Nov 12 (Tue) 14:00-15:30
Main,1226,Poster,Resources and Evaluation,DataTales: A Benchmark for Real-World Intelligent Data Narration,"Yajing Yang(~Yajing_Yang1),Qian Liu(~Qian_Liu2),Min-Yen Kan(~Min-Yen_Kan1)",TBA,TBA,Session 04,Resources and Evaluation 2,Nov 12 (Tue) 16:00-17:30
Main,1227,Poster,"Special Theme: Efficiency in Model Algorithms, Training, and Inference",Towards Fast Multilingual LLM Inference: Speculative Decoding and Specialized Drafters,"Euiin Yi(~Euiin_Yi1),Taehyeon Kim(~Taehyeon_Kim1),Hongseok Jeung(~Hongseok_Jeung2),Du-Seong Chang(~Du-Seong_Chang1),Se-Young Yun(~Se-Young_Yun1)",Euiin,Yi,Session 04,"Special Theme: Efficiency in Model Algorithms, Training, and Inference 2",Nov 12 (Tue) 16:00-17:30
Main,1231,VPoster,Summarization,"GlobeSumm: A Challenging Benchmark Towards Unifying Multi-lingual, Cross-lingual and Multi-document News Summarization","Yangfan Ye(~Yangfan_Ye1),Xiachong Feng(~Xiachong_Feng2),Xiaocheng Feng(~Xiaocheng_Feng1),Weitao Ma(~Weitao_Ma1),Libo Qin(~Libo_Qin1),Dongliang Xu(~Dongliang_Xu2),Qing Yang(~Qing_Yang11),Hongtao Liu(~Hongtao_Liu1),Bing Qin(~Bing_Qin2)",Yangfan,Ye,VPoster,,
Main,1233,Poster,Multilinguality and Language Diversity,Breaking the Curse of Multilinguality with Cross-lingual Expert Language Models,"Terra Blevins(~Terra_Blevins1),Tomasz Limisiewicz(~Tomasz_Limisiewicz1),Suchin Gururangan(~Suchin_Gururangan1),Margaret Li(~Margaret_Li1),Hila Gonen(~Hila_Gonen1),Noah A. Smith(~Noah_A._Smith2),Luke Zettlemoyer(~Luke_Zettlemoyer1)",Terra,Blevins,Session 03,Multilinguality and Language Diversity 1,Nov 12 (Tue) 14:00-15:30
Main,1234,Poster,NLP Applications,More Insightful Feedback for Tutoring: Enhancing Generation Mechanisms and Automatic Evaluation,"Wencke Liermann(~Wencke_Liermann1),Jin-Xia Huang(~Jin-Xia_Huang1),Yohan Lee(~Yohan_Lee4),Kong Joo Lee(~Kong_Joo_Lee1)",Wencke,Liermann,Session 06,NLP Applications 2,Nov 13 (Wed) 10:30-12:00
Main,1235,Poster,Interpretability and Analysis of Models for NLP,Stable Language Model Pre-training by Reducing Embedding Variability,"Woojin Chung(~Woojin_Chung1),Jiwoo Hong(~Jiwoo_Hong2),Na Min An(~Na_Min_An1),James Thorne(~James_Thorne1),Se-Young Yun(~Se-Young_Yun1)",Woojin,Chung,Session 03,Interpretability and Analysis of Models for NLP 2,Nov 12 (Tue) 14:00-15:30
Main,1239,VPoster,Multilinguality and Language Diversity,What is lost in Normalization? Exploring Pitfalls in Multilingual ASR Model Evaluations,"Kavya Manohar(~Kavya_Manohar1),Leena G Pillai(~Leena_G_Pillai1)",Kavya,Manohar,VPoster,,
Main,1240,Poster,"Sentiment Analysis, Stylistic Analysis, and Argument Mining",Diversity Over Size: On the Effect of Sample and Topic Sizes for Topic-Dependent Argument Mining Datasets,"Benjamin Schiller(~Benjamin_Schiller2),Johannes Daxenberger(~Johannes_Daxenberger1),Andreas Waldis(~Andreas_Waldis1),Iryna Gurevych(~Iryna_Gurevych1)",Andreas,Waldis,Session 04,"Sentiment Analysis, Stylistic Analysis, and Argument Mining",Nov 12 (Tue) 16:00-17:30
Main,1242,Poster,Interpretability and Analysis of Models for NLP,"Kiss up, Kick down: Exploring Behavioral Changes in Multi-modal Large Language Models with Assigned Visual Personas","Seungjong Sun(~Seungjong_Sun1),Eungu Lee(~Eungu_Lee1),Seo Yeon Baek(~Seo_Yeon_Baek1),Seunghyun Hwang(~Seunghyun_Hwang3),Lee wonbyung(~Lee_wonbyung1),Dongyan Nan(~Dongyan_Nan1),Bernard J Jansen(~Bernard_J_Jansen1),Jang Hyun Kim(~Jang_Hyun_Kim1)",Seungjong,Sun,Session 11,Interpretability and Analysis of Models for NLP 5,Nov 14 (Thu) 10:30-12:00
Main,1243,Poster,Generation,ATM: Adversarial Tuning Multi-agent System Makes a Robust Retrieval-Augmented Generator,"Junda Zhu(~Junda_Zhu1),Lingyong Yan(~Lingyong_Yan1),Haibo Shi(~Haibo_Shi2),Dawei Yin(~Dawei_Yin1),Lei Sha(~Lei_Sha1)",Junda,Zhu,Session 02,Generation 1,Nov 12 (Tue) 11:00-12:30
Main,1245,VPoster,"Sentiment Analysis, Stylistic Analysis, and Argument Mining",Dynamic Multi-granularity Attribution Network for Aspect-based Sentiment Analysis,"Yanjiang Chen(~Yanjiang_Chen1),Kai Zhang(~Kai_Zhang12),hufeng(~hufeng1),Xianquan Wang(~Xianquan_Wang1),Ruikang li(~Ruikang_li2),Qi Liu(~Qi_Liu3)",Yanjiang,Chen,VPoster,,
Main,1246,Poster,"Ethics, Bias, and Fairness",Unlabeled Debiasing in Downstream Tasks via Class-wise Low Variance Regularization,"Shahed Masoudian(~Shahed_Masoudian1),Markus Frohmann(~Markus_Frohmann1),Navid Rekabsaz(~Navid_Rekabsaz2),Markus Schedl(~Markus_Schedl1)",Shahed ,Masoudian,Session 11,"Ethics, Bias, and Fairness 4",Nov 14 (Thu) 10:30-12:00
Main,1249,VPoster,"Multimodality and Language Grounding to Vision, Robotics and Beyond",Large Language Models Know What is Key Visual Entity: An LLM-assisted Multimodal Retrieval for VQA,"Pu Jian(~Pu_Jian1),Donglei Yu(~Donglei_Yu1),Jiajun Zhang(~Jiajun_Zhang1)",Pu,Jian,VPoster,,
Main,1250,VPoster,Resources and Evaluation,"Towards Probing Speech-Specific Risks in Large Multimodal Models: A Taxonomy, Benchmark, and Insights","Hao Yang(~Hao_Yang26),Lizhen Qu(~Lizhen_Qu2),Ehsan Shareghi(~Ehsan_Shareghi1),Reza Haf(~Reza_Haf1)",Hao,Yang,VPoster,,
Main,1252,Oral,Interpretability and Analysis of Models for NLP,Self-AMPLIFY: Improving Small Language Models with Self Post Hoc Explanations,"Milan BHAN(~Milan_BHAN1),Jean-Noël Vittaut(~Jean-Noël_Vittaut1),Nicolas CHESNEAU(~Nicolas_CHESNEAU2),Marie-Jeanne Lesot(~Marie-Jeanne_Lesot1)",Milan,Bhan,Session 12,Interpretability and Analysis of Models for NLP 6,Nov 14 (Thu) 14:00-15:30
Main,1254,Poster,Dialogue and Interactive Systems,What are the Generator Preferences for End-to-end Task-Oriented Dialog System?,"Wanshi Xu(~Wanshi_Xu3),Xianwei Zhuang(~Xianwei_Zhuang2),Zhanpeng Chen(~Zhanpeng_Chen1),Zhihong Zhu(~Zhihong_Zhu1),Xuxin Cheng(~Xuxin_Cheng3),Yuexian Zou(~Yuexian_Zou4)",TBA,TBA,Session 12,Dialogue and Interactive Systems 3,Nov 14 (Thu) 14:00-15:30
Main,1257,Poster,Interpretability and Analysis of Models for NLP,Paraphrase Types Elicit Prompt Engineering Capabilities,"Jan Philip Wahle(~Jan_Philip_Wahle1),Terry Ruas(~Terry_Ruas1),Yang Xu(~Yang_Xu7),Bela Gipp(~Bela_Gipp1)",Jan Philip,Wahle,Session 06,Interpretability and Analysis of Models for NLP 3,Nov 13 (Wed) 10:30-12:00
Main,1261,Poster,"Multimodality and Language Grounding to Vision, Robotics and Beyond",VLEU: a Method for Automatic Evaluation for Generalizability of Text-to-Image Models,"Jingtao Cao(~Jingtao_Cao1),Zhang Zheng(~Zhang_Zheng2),Hongru WANG(~Hongru_WANG1),Kam-Fai Wong(~Kam-Fai_Wong2)",Jingtao,Cao,Session 02,"Multimodality and Language Grounding to Vision, Robotics and Beyond 1",Nov 12 (Tue) 11:00-12:30
Main,1264,VPoster,Machine Learning for NLP,Towards Online Continuous Sign Language Recognition and Translation,"Ronglai Zuo(~Ronglai_Zuo1),Fangyun Wei(~Fangyun_Wei1),Brian Mak(~Brian_Mak1)",Brian,Mak,VPoster,,
Main,1267,VPoster,"Ethics, Bias, and Fairness",Mitigate Extrinsic Social Bias in Pre-trained Language Models via Continuous Prompts Adjustment,"Yiwei Dai(~Yiwei_Dai1),Hengrui Gu(~Hengrui_Gu1),Ying Wang(~Ying_Wang13),Xin Wang(~Xin_Wang54)",Yiwei,Dai,VPoster,,
Main,1268,VPoster,"Ethics, Bias, and Fairness",Split and Merge: Aligning Position Biases in LLM-based Evaluators,"Zongjie Li(~Zongjie_Li1),Chaozheng Wang(~Chaozheng_Wang1),Pingchuan Ma(~Pingchuan_Ma4),Daoyuan Wu(~Daoyuan_Wu1),Shuai Wang(~Shuai_Wang7),Cuiyun Gao(~Cuiyun_Gao1),Yang Liu(~Yang_Liu36)",Zongjie,Li,VPoster,,
Main,1273,Poster,Dialogue and Interactive Systems,Integrating Argumentation and Hate-Speech-based Techniques for Countering Misinformation,"Sougata Saha(~Sougata_Saha1),Rohini Srihari(~Rohini_Srihari1)",Sougata,Saha,Session 09,Dialogue and Interactive Systems 2,Nov 13 (Wed) 16:00-17:30
Main,1278,Poster,Machine Learning for NLP,BPO: Supercharging Online Preference Learning by Adhering to the Proximity of Behavior LLM,"Wenda Xu(~Wenda_Xu1),Jiachen Li(~Jiachen_Li6),William Yang Wang(~William_Yang_Wang2),Lei Li(~Lei_Li11)",TBA,TBA,Session 11,Machine Learning for NLP 3,Nov 14 (Thu) 10:30-12:00
Main,1291,VPoster,Information Extraction,One2Set + Large Language Model: Best Partners for Keyphrase Generation,"Liangying Shao(~Liangying_Shao1),Liang Zhang(~Liang_Zhang9),Minlong Peng(~Minlong_Peng1),Guoqi Ma(~Guoqi_Ma2),Hao Yue(~Hao_Yue2),Mingming Sun(~Mingming_Sun1),Jinsong Su(~Jinsong_Su1)",Jinsong,Su,VPoster,,
