Type,Paper ID,Oral / Poster,Track Theme,Title,Authors Names,Presenter first name,Presenter last name,Session,Sub-session,Session Time
FIND,2433,Poster,Resources and Evaluation,Language Models are Surprisingly Fragile to Drug Names in Biomedical Benchmarks,"Jack Gallifant(~Jack_Gallifant1),Shan Chen(~Shan_Chen1),Pedro José Ferreira Moreira(~Pedro_José_Ferreira_Moreira1),Nikolaj Munch(~Nikolaj_Munch1),Mingye Gao(~Mingye_Gao1),Jackson Pond(~Jackson_Pond1),Leo Anthony Celi(~Leo_Anthony_Celi1),Hugo Aerts(~Hugo_Aerts2),Thomas Hartvigsen(~Thomas_Hartvigsen1),Danielle Bitterman(~Danielle_Bitterman1)",Jack,Gallifant,Session 06,Resources and Evaluation 3,Nov 13 (Wed) 10:30-12:00
FIND,2434,Poster,NLP Applications,"To Err Is Human, but Llamas Can Learn It Too","Agnes Luhtaru(~Agnes_Luhtaru1),Taido Purason(~Taido_Purason1),Martin Vainikko(~Martin_Vainikko1),Maksym Del(~Maksym_Del3),Mark Fishel(~Mark_Fishel1)",Agnes,Luhtaru,Session 12,NLP Applications 5,Nov 14 (Thu) 14:00-15:30
FIND,2437,Poster,Resources and Evaluation,PizzaCommonSense: A Dataset for Commonsense Reasoning about Intermediate Steps in Cooking Recipes,"Aissatou Diallo(~Aissatou_Diallo1),Antonis Bikakis(~Antonis_Bikakis1),Luke Dickens(~Luke_Dickens1),Anthony Hunter(~Anthony_Hunter1),Rob Miller(~Rob_Miller2)",Aissatou,Diallo,Session 11,Resources and Evaluation 5,Nov 14 (Thu) 10:30-12:00
FIND,2439,Not Presenting,,Enhancing Discourse Dependency Parsing with Sentence Dependency Parsing: A Unified Generative Method Based on Code Representation,"Zizhuo Shen(~Zizhuo_Shen2),Yanqiu Shao(~Yanqiu_Shao1)",Zizhuo,Shen,Not Presenting,,
FIND,244,Not Presenting,,SAFETY-J: Evaluating Safety with Critique,"Yixiu Liu(~Yixiu_Liu2),Yuxiang Zheng(~Yuxiang_Zheng3),Shijie Xia(~Shijie_Xia2),Jiajun Li(~Jiajun_Li2),Yi Tu(~Yi_Tu3),Chaoling Song(~Chaoling_Song2),Pengfei Liu(~Pengfei_Liu1)",TBA,TBA,Not Presenting,,
FIND,2440,Poster,Resources and Evaluation,"""Knowing When You Don't Know"": A Multilingual Relevance Assessment Dataset for Robust Retrieval-Augmented Generation","Nandan Thakur(~Nandan_Thakur1),Luiz Bonifacio(~Luiz_Bonifacio1),Crystina Zhang(~Crystina_Zhang1),Odunayo Ogundepo(~Odunayo_Ogundepo1),Ehsan Kamalloo(~Ehsan_Kamalloo1),David Alfonso-Hermelo(~David_Alfonso-Hermelo1),Xiaoguang Li(~Xiaoguang_Li1),Qun Liu(~Qun_Liu1),Boxing Chen(~Boxing_Chen1),Mehdi Rezagholizadeh(~Mehdi_Rezagholizadeh1),Jimmy Lin(~Jimmy_Lin2)",Nandan,Thakur,Session 11,Resources and Evaluation 5,Nov 14 (Thu) 10:30-12:00
FIND,2446,Poster,Dialogue and Interactive Systems,Diverse and Effective Synthetic Data Generation for Adaptable Zero-Shot Dialogue State Tracking,"James D. Finch(~James_D._Finch1),Jinho D. Choi(~Jinho_D._Choi1)",James,Finch,Session 09,Dialogue and Interactive Systems 2,Nov 13 (Wed) 16:00-17:30
FIND,2448,VPoster,Interpretability and Analysis of Models for NLP,Can We Instruct LLMs to Compensate for Position Bias?,"Meiru Zhang(~Meiru_Zhang1),Zaiqiao Meng(~Zaiqiao_Meng1),Nigel Collier(~Nigel_Collier1)",Meiru,Zhang,VPoster,,
FIND,2454,Poster,Information Retrieval and Text Mining,Textual Dataset Distillation via Language Model Embedding,"Yefan Tao(~Yefan_Tao1),Luyang Kong(~Luyang_Kong1),Andrey Kan(~Andrey_Kan1),Laurent Callot(~Laurent_Callot1)",luyang,kong,Session 02,Information Retrieval and Text Mining 1,Nov 12 (Tue) 11:00-12:30
FIND,2455,VPoster,"Sentiment Analysis, Stylistic Analysis, and Argument Mining",TARA: Token-level Attribute Relation Adaptation for Multi-Attribute Controllable Text Generation,"Yilin Cao(~Yilin_Cao1),Jiahao Zhao(~Jiahao_Zhao1),Ruike Zhang(~Ruike_Zhang1),Hanyi Zou(~Hanyi_Zou1),Wenji Mao(~Wenji_Mao1)",Yilin,Cao,VPoster,,
FIND,2459,Not Presenting,,Guess You Will Think So: Adversarial User Intention Learning in Sequential Recommendation,"Junjie Zhang(~Junjie_Zhang11),Ruobing Xie(~Ruobing_Xie2),Wenqi Sun(~Wenqi_Sun1),Leyu Lin(~Leyu_Lin2),Xin Zhao(~Xin_Zhao10),Ji-Rong Wen(~Ji-Rong_Wen1)",Junjie ,Zhang,Not Presenting,,
FIND,2463,VPoster,NLP Applications,Denoising Rationalization for Multi-hop Fact Verification via Multi-granular Explainer,"Jiasheng Si(~Jiasheng_Si1),Yingjie Zhu(~Yingjie_Zhu1),Wenpeng Lu(~Wenpeng_Lu1),Deyu Zhou(~Deyu_Zhou1)",Jiasheng,Si,VPoster,,
FIND,2466,Poster,Resources and Evaluation,README: Bridging Medical Jargon and Lay Understanding for Patient Education through Data-Centric NLP,"Zonghai Yao(~Zonghai_Yao1),Nandyala Siddharth Kantu(~Nandyala_Siddharth_Kantu1),Guanghao Wei(~Guanghao_Wei1),Hieu Tran(~Hieu_Tran3),Zhangqi Duan(~Zhangqi_Duan1),SUNJAE KWON(~SUNJAE_KWON1),Zhichao Yang(~Zhichao_Yang2),hong yu(~hong_yu1)",Zonghai,Yao,Session 06,Resources and Evaluation 3,Nov 13 (Wed) 10:30-12:00
FIND,2468,Poster,Interpretability and Analysis of Models for NLP,Pre-trained Language Models Return Distinguishable Probability Distributions to Unfaithfully Hallucinated Texts,"Taehun Cha(~Taehun_Cha1),Donghun Lee(~Donghun_Lee4)",Taehun,Cha,Session 11,Interpretability and Analysis of Models for NLP 5,Nov 14 (Thu) 10:30-12:00
FIND,2469,Poster,Human-centered NLP,Cognitive Bias in Decision-Making with LLMs,"Jessica Maria Echterhoff(~Jessica_Maria_Echterhoff1),Yao Liu(~Yao_Liu11),Abeer Alessa(~Abeer_Alessa2),Julian McAuley(~Julian_McAuley1),Zexue He(~Zexue_He1)",Jessica ,Echterhoff,Session 06,Human-centered NLP 2,Nov 13 (Wed) 10:30-12:00
FIND,2477,Poster,Dialogue and Interactive Systems,Problem-Oriented Segmentation and Retrieval: Case Study on Tutoring Conversations,"Rose E Wang(~Rose_E_Wang1),Pawan Wirawarn(~Pawan_Wirawarn1),Kenny Lam(~Kenny_Lam1),Omar Khattab(~Omar_Khattab1),Dorottya Demszky(~Dorottya_Demszky1)",Pawan,Wirawarn,Session 12,Dialogue and Interactive Systems 3,Nov 14 (Thu) 14:00-15:30
FIND,2482,Poster,Language Modeling,Prompt-Based Bias Calibration for Better Zero/Few-Shot Learning of Language Models,"Kang He(~Kang_He2),Yinghan Long(~Yinghan_Long1),Kaushik Roy(~Kaushik_Roy1)",Kang,He,Session 09,Language Modeling 3,Nov 13 (Wed) 16:00-17:30
FIND,2487,Not Presenting,,Can’t Remember Details in Long Documents? You Need Some R&R,"Devanshu Agrawal(~Devanshu_Agrawal1),Shang Gao(~Shang_Gao7),Martin Gajek(~Martin_Gajek1)",Devanshu,Agrawal,Not Presenting,,
FIND,2490,Poster,Resources and Evaluation,DAVINCI: Dataset for Detection of Violent Incidents,"Hemank Lamba(~Hemank_Lamba1),Anton Abilov(~Anton_Abilov1),Ke Zhang(~Ke_Zhang10),Elizabeth M Olson(~Elizabeth_M_Olson1),Henry Kudzanai Dambanemuya(~Henry_Kudzanai_Dambanemuya1),João Cordovil Bárcia(~João_Cordovil_Bárcia1),David S. Batista(~David_S._Batista1),Christina Wille(~Christina_Wille1),Aoife Cahill(~Aoife_Cahill1),Joel R. Tetreault(~Joel_R._Tetreault2),Alejandro Jaimes(~Alejandro_Jaimes2)",Joel,Tetreault,Session 04,Resources and Evaluation 2,Nov 12 (Tue) 16:00-17:30
FIND,2491,Poster,Computational Social Science and Cultural Analytics,Improving Quotation Attribution with Fictional Character Embeddings,"Gaspard Michel(~Gaspard_Michel2),Elena V. Epure(~Elena_V._Epure1),Romain Hennequin(~Romain_Hennequin1),Christophe Cerisara(~Christophe_Cerisara2)",Gaspard,Michel,Session 12,Computational Social Science and Cultural Analytics 4,Nov 14 (Thu) 14:00-15:30
FIND,2492,Poster,Interpretability and Analysis of Models for NLP,Robust Text Classification: Analyzing Prototype-Based Networks,"Zhivar Sourati(~Zhivar_Sourati1),Darshan Girish Deshpande(~Darshan_Girish_Deshpande1),Filip Ilievski(~Filip_Ilievski1),Kiril Gashteovski(~Kiril_Gashteovski1),Sascha Saralajew(~Sascha_Saralajew1)",Zhivar,Sourati,Session 11,Interpretability and Analysis of Models for NLP 5,Nov 14 (Thu) 10:30-12:00
FIND,2496,Not Presenting,,GraphReader: Building Graph-based Agent to Enhance Long-Context Abilities of Large Language Models,"Shilong Li(~Shilong_Li3),Yancheng He(~Yancheng_He4),Hangyu Guo(~Hangyu_Guo2),Xingyuan Bu(~Xingyuan_Bu1),Ge Bai(~Ge_Bai2),Jie Liu(~Jie_Liu13),Jiaheng Liu(~Jiaheng_Liu1),Xingwei Qu(~Xingwei_Qu1),Yangguang Li(~Yangguang_Li1),Wanli Ouyang(~Wanli_Ouyang1),Wenbo Su(~Wenbo_Su2),Bo Zheng(~Bo_Zheng5)",Xingyuan,Bu,Not Presenting,,
FIND,250,Not Presenting,,Improving Demonstration Diversity by Human-Free Fusing for Text-to-SQL,"Dingzirui Wang(~Dingzirui_Wang1),Longxu Dou(~Longxu_Dou1),Xuanliang Zhang(~Xuanliang_Zhang1),Qingfu Zhu(~Qingfu_Zhu1),Wanxiang Che(~Wanxiang_Che1)",Dingzirui,Wang,Not Presenting,,
FIND,2502,Poster,Generation,Compare without Despair: Reliable Preference Evaluation with Generation Separability,"Sayan Ghosh(~Sayan_Ghosh5),Tejas Srinivasan(~Tejas_Srinivasan1),Swabha Swayamdipta(~Swabha_Swayamdipta1)",Sayan ,Ghosh,Session 02,Generation 1,Nov 12 (Tue) 11:00-12:30
FIND,2507,VPoster,"Special Theme: Efficiency in Model Algorithms, Training, and Inference",Expressive and Generalizable Low-rank Adaptation for Large Models via Slow Cascaded Learning,"Siwei Li(~Siwei_Li3),Yifan Yang(~Yifan_Yang9),Yifei Shen(~Yifei_Shen1),Fangyun Wei(~Fangyun_Wei1),Zongqing Lu(~Zongqing_Lu3),Lili Qiu(~Lili_Qiu3),Yuqing Yang(~Yuqing_Yang1)",Yifan,Yang,VPoster,,
FIND,2508,Poster,Machine Learning for NLP,SQFT: Low-cost Model Adaptation in Low-precision Sparse Foundation Models,"Juan Pablo Munoz(~Juan_Pablo_Munoz1),Jinjie Yuan(~Jinjie_Yuan1),Nilesh Jain(~Nilesh_Jain1)",J. Pablo,Munoz,Session 03,Machine Learning for NLP 1,Nov 12 (Tue) 14:00-15:30
FIND,2510,Poster,"Ethics, Bias, and Fairness",Securing Multi-turn Conversational Language Models from Distributed Backdoor Attacks,"Terry Tong(~Terry_Tong1),Qin Liu(~Qin_Liu5),Jiashu Xu(~Jiashu_Xu1),Muhao Chen(~Muhao_Chen1)",Terry,Tong,Session 11,"Ethics, Bias, and Fairness 4",Nov 14 (Thu) 10:30-12:00
FIND,2512,Poster,Interpretability and Analysis of Models for NLP,InternalInspector $I^2$: Robust Confidence Estimation in LLMs through Internal States,"Mohammad Beigi(~Mohammad_Beigi1),Ying Shen(~Ying_Shen4),Runing Yang(~Runing_Yang1),Zihao Lin(~Zihao_Lin1),Qifan Wang(~Qifan_Wang2),Ankith Mohan(~Ankith_Mohan1),Jianfeng He(~Jianfeng_He1),Ming Jin(~Ming_Jin2),Chang-Tien Lu(~Chang-Tien_Lu1),Lifu Huang(~Lifu_Huang1)",Mohammad,Beigi,Session 03,Interpretability and Analysis of Models for NLP 2,Nov 12 (Tue) 14:00-15:30
FIND,2519,Poster,Low-resource Methods for NLP,All You Need is Attention: Lightweight Attention-based Data Augmentation for Text Classification,"Junehyung Kim(~Junehyung_Kim1),Sungjae Hwang(~Sungjae_Hwang1)",Junehyung,Kim,Session 06,Low-resource Methods for NLP 2,Nov 13 (Wed) 10:30-12:00
FIND,252,Poster,"Ethics, Bias, and Fairness",A Unified Framework and Dataset for Assessing Societal Bias in Vision-Language Models,"Ashutosh Sathe(~Ashutosh_Sathe1),Prachi Jain(~Prachi_Jain3),Sunayana Sitaram(~Sunayana_Sitaram1)",Prachi Jain,Jain,Session 11,"Ethics, Bias, and Fairness 4",Nov 14 (Thu) 10:30-12:00
FIND,2524,Poster,"Multimodality and Language Grounding to Vision, Robotics and Beyond",Adversarial Attacks on Parts of Speech: An Empirical Study in Text-to-Image Generation,"G M Shahariar(~G_M_Shahariar1),Jia Chen(~Jia_Chen5),Jiachen Li(~Jiachen_Li1),Yue Dong(~Yue_Dong2)",G M,Shahariar,Session 12,"Multimodality and Language Grounding to Vision, Robotics and Beyond 5",Nov 14 (Thu) 14:00-15:30
FIND,2525,Poster,Generation,Enhancing Alignment using Curriculum Learning & Ranked Preferences,"Pulkit Pattnaik(~Pulkit_Pattnaik1),Rishabh Maheshwary(~Rishabh_Maheshwary2),Kelechi Ogueji(~Kelechi_Ogueji1),Vikas Yadav(~Vikas_Yadav2),Sathwik Tejaswi Madhusudhan(~Sathwik_Tejaswi_Madhusudhan2)",Rishabh,Maheshwary,Session 11,Generation 2,Nov 14 (Thu) 10:30-12:00
FIND,2526,Poster,Summarization,Multi-Target Cross-Lingual Summarization: a novel task and a language-neutral approach,"Diogo Pernes(~Diogo_Pernes1),Gonçalo M. Correia(~Gonçalo_M._Correia1),Afonso Mendes(~Afonso_Mendes2)",Gonçalo,Correia,Session 04,Summarization,Nov 12 (Tue) 16:00-17:30
FIND,2528,Poster,NLP Applications,Tab2Text - A framework for deep learning with tabular data,"Tong Lin(~Tong_Lin3),Jason Yan(~Jason_Yan2),David Jurgens(~David_Jurgens1),Sabina J Tomkins(~Sabina_J_Tomkins1)",Tong,Lin,Session 12,NLP Applications 5,Nov 14 (Thu) 14:00-15:30
FIND,2530,Not Presenting,,More Bang for your Context: Virtual Documents for Question Answering over Long Documents,"Yosi Mass(~Yosi_Mass1),Boaz Carmeli(~Boaz_Carmeli1),Asaf Yehudai(~Asaf_Yehudai1),Assaf Toledo(~Assaf_Toledo1),Nathaniel Mills(~Nathaniel_Mills1)",TBA,TBA,Not Presenting,,
FIND,2534,Poster,Machine Learning for NLP,Out-of-Distribution Detection through Soft Clustering with Non-Negative Kernel Regression,"Aryan Gulati(~Aryan_Gulati1),Xingjian Dong(~Xingjian_Dong1),Carlos Hurtado(~Carlos_Hurtado3),Sarath Shekkizhar(~Sarath_Shekkizhar1),Swabha Swayamdipta(~Swabha_Swayamdipta1),Antonio Ortega(~Antonio_Ortega1)",Aryan,Gulati,Session 11,Machine Learning for NLP 3,Nov 14 (Thu) 10:30-12:00
FIND,2542,Poster,Question Answering,Synthetic Multimodal Question Generation,"Ian Wu(~Ian_Wu3),Sravan Jayanthi(~Sravan_Jayanthi1),Vijay Viswanathan(~Vijay_Viswanathan1),Simon Rosenberg(~Simon_Rosenberg2),Sina Khoshfetrat Pakazad(~Sina_Khoshfetrat_Pakazad1),Tongshuang Wu(~Tongshuang_Wu1),Graham Neubig(~Graham_Neubig1)",Ian,Wu,Session 09,Question Answering 3,Nov 13 (Wed) 16:00-17:30
FIND,2548,Poster,Interpretability and Analysis of Models for NLP,Lost in Translation: Chemical Language Models and the Misunderstanding of Molecule Structures,"Veronika Ganeeva(~Veronika_Ganeeva1),Andrey Sakhovskiy(~Andrey_Sakhovskiy1),Kuzma Khrabrov(~Kuzma_Khrabrov1),Andrey Savchenko(~Andrey_Savchenko1),Artur Kadurin(~Artur_Kadurin1),Elena Tutubalina(~Elena_Tutubalina1)",Elena,Tutubalina,Session 06,Interpretability and Analysis of Models for NLP 3,Nov 13 (Wed) 10:30-12:00
FIND,255,VPoster,Information Extraction,Breaking the Boundaries: A Unified Framework for Chinese Named Entity Recognition Across Text and Speech,"Jinzhong Ning(~Jinzhong_Ning1),Yuanyuan Sun(~Yuanyuan_Sun1),Bo Xu(~Bo_Xu8),Zhihao Yang(~Zhihao_Yang1),Ling Luo(~Ling_Luo2),Hongfei Lin(~Hongfei_Lin3)",Jinzhong,Ning,VPoster,,
FIND,2550,Poster,Information Retrieval and Text Mining,HyQE: Ranking Contexts with Hypothetical Query Embeddings,"Weichao Zhou(~Weichao_Zhou1),Jiaxin Zhang(~Jiaxin_Zhang2),Hilaf Hasson(~Hilaf_Hasson1),Anu Singh(~Anu_Singh1),Wenchao Li(~Wenchao_Li1)",Wenchao,Li,Session 09,Information Retrieval and Text Mining 3,Nov 13 (Wed) 16:00-17:30
FIND,2551,Poster,"Ethics, Bias, and Fairness",Model Merging and Safety Alignment: One Bad Model Spoils the Bunch,"Hasan Abed Al Kader Hammoud(~Hasan_Abed_Al_Kader_Hammoud1),Umberto Michieli(~Umberto_Michieli1),Fabio Pizzati(~Fabio_Pizzati1),Philip Torr(~Philip_Torr1),Adel Bibi(~Adel_Bibi1),Bernard Ghanem(~Bernard_Ghanem1),Mete Ozay(~Mete_Ozay3)",Mete,Ozay,Session 11,"Ethics, Bias, and Fairness 4",Nov 14 (Thu) 10:30-12:00
FIND,2554,Poster,"Multimodality and Language Grounding to Vision, Robotics and Beyond",Large Language Models Are Challenged by Habitat-Centered Reasoning,"Sadaf Ghaffari(~Sadaf_Ghaffari1),Nikhil Krishnaswamy(~Nikhil_Krishnaswamy1)",Sadaf,Ghaffari,Session 09,"Multimodality and Language Grounding to Vision, Robotics and Beyond 4",Nov 13 (Wed) 16:00-17:30
FIND,2555,Poster,NLP Applications,How to Train Your Fact Verifier: Knowledge Transfer with Multimodal Open Models,"Jaeyoung Lee(~Jaeyoung_Lee2),Ximing Lu(~Ximing_Lu1),Jack Hessel(~Jack_Hessel1),Faeze Brahman(~Faeze_Brahman1),Youngjae Yu(~Youngjae_Yu1),Yonatan Bisk(~Yonatan_Bisk1),Yejin Choi(~Yejin_Choi1),Saadia Gabriel(~Saadia_Gabriel1)",Jaeyoung,Lee,Session 12,NLP Applications 5,Nov 14 (Thu) 14:00-15:30
FIND,2557,Poster,Machine Translation,Benchmarking Machine Translation with Cultural Awareness,"Binwei Yao(~Binwei_Yao1),Ming Jiang(~Ming_Jiang6),Tara Bobinac(~Tara_Bobinac1),Diyi Yang(~Diyi_Yang2),Junjie Hu(~Junjie_Hu2)",Binwei,Yao,Session 04,Machine Translation 2,Nov 12 (Tue) 16:00-17:30
FIND,2560,Poster,Multilinguality and Language Diversity,Turning English-centric LLMs Into Polyglots: How Much Multilinguality Is Needed?,"Tannon Kew(~Tannon_Kew1),Florian Schottmann(~Florian_Schottmann1),Rico Sennrich(~Rico_Sennrich1)",Tannon,Kew,Session 03,Multilinguality and Language Diversity 1,Nov 12 (Tue) 14:00-15:30
FIND,2561,Poster,"Special Theme: Efficiency in Model Algorithms, Training, and Inference",Temperature-Centric Investigation of Speculative Decoding with Knowledge Distillation,"Siru Ouyang(~Siru_Ouyang1),Shuohang Wang(~Shuohang_Wang1),Minhao Jiang(~Minhao_Jiang1),Ming Zhong(~Ming_Zhong2),Donghan Yu(~Donghan_Yu2),Jiawei Han(~Jiawei_Han1),yelong shen(~yelong_shen1)",Siru,Ouyang,Session 11,"Special Theme: Efficiency in Model Algorithms, Training, and Inference 3",Nov 14 (Thu) 10:30-12:00
FIND,2565,Poster,Low-resource Methods for NLP,Generate then Refine: Data Augmentation for Zero-shot Intent Detection,"I-Fan Lin(~I-Fan_Lin1),Faegheh Hasibi(~Faegheh_Hasibi2),Suzan Verberne(~Suzan_Verberne1)",I-Fan,Lin,Session 06,Low-resource Methods for NLP 2,Nov 13 (Wed) 10:30-12:00
FIND,2567,VPoster,Information Extraction,Unleashing the Power of Large Language Models in Zero-shot Relation Extraction via Self-Prompting,"Siyi Liu(~Siyi_Liu1),Yang Li(~Yang_Li45),Jiang Li(~Jiang_Li8),Shan Yang(~Shan_Yang5),Yunshi Lan(~Yunshi_Lan1)",Siyi,Liu,VPoster,,
FIND,257,Not Presenting,,VGA: Vision GUI Assistant - Minimizing Hallucinations through Image-Centric Fine-Tuning,"Meng ziyang(~Meng_ziyang1),Yu Dai(~Yu_Dai4),Zezheng Gong(~Zezheng_Gong1),ShaoxiongGuo(~ShaoxiongGuo1),Minglong Tang(~Minglong_Tang1),Tongquan Wei(~Tongquan_Wei1)",TBA,TBA,Not Presenting,,
FIND,2570,Poster,Resources and Evaluation,“What is the value of {templates}?” Rethinking Document Information Extraction Datasets for LLMs,"Ran Zmigrod(~Ran_Zmigrod1),Pranav Shetty(~Pranav_Shetty1),Mathieu Sibue(~Mathieu_Sibue1),Zhiqiang Ma(~Zhiqiang_Ma2),Armineh Nourbakhsh(~Armineh_Nourbakhsh1),Xiaomo Liu(~Xiaomo_Liu1),Manuela Veloso(~Manuela_Veloso1)",Pranav,Shetty,Session 11,Resources and Evaluation 5,Nov 14 (Thu) 10:30-12:00
FIND,2573,Poster,Interpretability and Analysis of Models for NLP,What Matters in Learning Facts in Language Models? Multifaceted Knowledge Probing with Diverse Multi-Prompt Datasets,"Xin Zhao(~Xin_Zhao22),Naoki Yoshinaga(~Naoki_Yoshinaga1),Daisuke Oba(~Daisuke_Oba1)",Xin,Zhao,Session 11,Interpretability and Analysis of Models for NLP 5,Nov 14 (Thu) 10:30-12:00
FIND,2575,Poster,Resources and Evaluation,On Leakage of Code Generation Evaluation Datasets,"Alexandre Matton(~Alexandre_Matton3),Tom Sherborne(~Tom_Sherborne2),Dennis Aumiller(~Dennis_Aumiller1),Elena Tommasone(~Elena_Tommasone1),Milad Alizadeh(~Milad_Alizadeh1),Jingyi He(~Jingyi_He1),Raymond Ma(~Raymond_Ma1),Maxime Voisin(~Maxime_Voisin1),Ellen Gilsenan-McMahon(~Ellen_Gilsenan-McMahon1),Matthias Gallé(~Matthias_Gallé1)",Alexandre,Matton,Session 11,Resources and Evaluation 5,Nov 14 (Thu) 10:30-12:00
FIND,258,Not Presenting,,Understanding the Therapeutic Relationship between Counselors and Clients in Online Text-based Counseling using LLMs,"Anqi Li(~Anqi_Li2),Yu Lu(~Yu_Lu7),Nirui Song(~Nirui_Song1),Shuai Zhang(~Shuai_Zhang19),Lizhi Ma(~Lizhi_Ma1),Zhenzhong Lan(~Zhenzhong_Lan2)",TBA,TBA,Not Presenting,,
FIND,2580,Poster,Computational Social Science and Cultural Analytics,The Language of Trauma: Modeling Traumatic Event Descriptions Across Domains with Explainable AI,"Miriam Schirmer(~Miriam_Schirmer1),Tobias Leemann(~Tobias_Leemann1),Gjergji Kasneci(~Gjergji_Kasneci2),Jürgen Pfeffer(~Jürgen_Pfeffer1),David Jurgens(~David_Jurgens1)",Miriam,Schirmer,Session 12,Computational Social Science and Cultural Analytics 4,Nov 14 (Thu) 14:00-15:30
FIND,2582,Poster,Language Modeling,Auto-Evolve: Enhancing Large Language Model's Performance via Self-Reasoning Framework,"Krishna Aswani(~Krishna_Aswani1),Huilin Lu(~Huilin_Lu1),Pranav Patankar(~Pranav_Patankar1),Priya Dhalwani(~Priya_Dhalwani1),Xue Tan(~Xue_Tan1),Jayant Ganeshmohan(~Jayant_Ganeshmohan1),Simon Lacasse(~Simon_Lacasse1)",Huilin,Lu,Session 09,Language Modeling 3,Nov 13 (Wed) 16:00-17:30
FIND,2588,Poster,"Multimodality and Language Grounding to Vision, Robotics and Beyond",V-DPO: Mitigating Hallucination in Large Vision Language Models via Vision-Guided Direct Preference Optimization,"Yuxi Xie(~Yuxi_Xie1),Guanzhen Li(~Guanzhen_Li1),Xiao Xu(~Xiao_Xu1),Min-Yen Kan(~Min-Yen_Kan1)",Yuxi,Xie,Session 12,"Multimodality and Language Grounding to Vision, Robotics and Beyond 5",Nov 14 (Thu) 14:00-15:30
FIND,2590,VPoster,Speech Processing and Spoken Language Understanding,Exploring the Potential of Multimodal LLM with Knowledge-Intensive Multimodal ASR,"Minghan Wang(~Minghan_Wang1),Yuxia Wang(~Yuxia_Wang1),Thuy-Trang Vu(~Thuy-Trang_Vu1),Ehsan Shareghi(~Ehsan_Shareghi1),Reza Haf(~Reza_Haf1)",Minghan,Wang,VPoster,,
FIND,2595,Poster,Machine Learning for NLP,Better Alignment with Instruction Back-and-Forth Translation,"Thao Nguyen(~Thao_Nguyen3),Jeffrey Li(~Jeffrey_Li1),Sewoong Oh(~Sewoong_Oh3),Ludwig Schmidt(~Ludwig_Schmidt1),Jason E Weston(~Jason_E_Weston1),Luke Zettlemoyer(~Luke_Zettlemoyer1),Xian Li(~Xian_Li1)",Thao,Nguyen,Session 11,Machine Learning for NLP 3,Nov 14 (Thu) 10:30-12:00
FIND,2596,Poster,Information Extraction,AliGATr: Graph-based layout generation for form understanding,"Armineh Nourbakhsh(~Armineh_Nourbakhsh1),Zhao Jin(~Zhao_Jin1),Siddharth Parekh(~Siddharth_Parekh1),Sameena Shah(~Sameena_Shah1),Carolyn Rose(~Carolyn_Rose1)",Siddharth,Parekh,Session 12,Information Extraction 2,Nov 14 (Thu) 14:00-15:30
FIND,2597,Poster,Machine Learning for NLP,Attribute Controlled Fine-tuning for Large Language Models: A Case Study on Detoxification,"Tao Meng(~Tao_Meng2),Ninareh Mehrabi(~Ninareh_Mehrabi2),Palash Goyal(~Palash_Goyal1),Anil Ramakrishna(~Anil_Ramakrishna1),Aram Galstyan(~Aram_Galstyan1),Richard Zemel(~Richard_Zemel1),Kai-Wei Chang(~Kai-Wei_Chang1),Rahul Gupta(~Rahul_Gupta3),Charith Peris(~Charith_Peris1)",Tao,Meng,Session 11,Machine Learning for NLP 3,Nov 14 (Thu) 10:30-12:00
FIND,2600,Poster,NLP Applications,SciDoc2Diagrammer-MAF: Towards Generation of Scientific Diagrams from Documents guided by Multi-Aspect Feedback Refinement,"Ishani Mondal(~Ishani_Mondal1),Zongxia Li(~Zongxia_Li1),Yufang Hou(~Yufang_Hou2),Anandhavelu Natarajan(~Anandhavelu_Natarajan1),Aparna Garimella(~Aparna_Garimella1),Jordan Lee Boyd-Graber(~Jordan_Lee_Boyd-Graber1)",Ishani Mondal,Jordan Boyd-Graver,Session 12,NLP Applications 5,Nov 14 (Thu) 14:00-15:30
FIND,2601,Poster,Generation,TinyStyler: Efficient Few-Shot Text Style Transfer with Authorship Embeddings,"Zachary Horvitz(~Zachary_Horvitz2),Ajay Patel(~Ajay_Patel2),Kanishk Singh(~Kanishk_Singh2),Chris Callison-Burch(~Chris_Callison-Burch1),Kathleen McKeown(~Kathleen_McKeown1),Zhou Yu(~Zhou_Yu1)",Zachary,Horvitz,Session 11,Generation 2,Nov 14 (Thu) 10:30-12:00
FIND,2603,Poster,Dialogue and Interactive Systems,Can LLMs Understand the Implication of Emphasized Sentences in Dialogue?,"Guan-Ting Lin(~Guan-Ting_Lin1),Hung-yi Lee(~Hung-yi_Lee2)",Guan-Ting,Lin,Session 12,Dialogue and Interactive Systems 3,Nov 14 (Thu) 14:00-15:30
FIND,2608,Not Presenting,,Why do LLaVA Vision-Language Models Reply to Images in English?,"Musashi Hinck(~Musashi_Hinck1),Carolin Holtermann(~Carolin_Holtermann1),Matthew Lyle Olson(~Matthew_Lyle_Olson1),Florian Schneider(~Florian_Schneider1),Sungduk Yu(~Sungduk_Yu1),Anahita Bhiwandiwalla(~Anahita_Bhiwandiwalla1),Anne Lauscher(~Anne_Lauscher1),Shao-Yen Tseng(~Shao-Yen_Tseng1),Vasudev Lal(~Vasudev_Lal1)",Musashi,Hinck,Not Presenting,,
FIND,2610,Poster,Dialogue and Interactive Systems,Preference Tuning For Toxicity Mitigation Generalizes Across Languages,"Xiaochen Li(~Xiaochen_Li1),Zheng Xin Yong(~Zheng_Xin_Yong1),Stephen Bach(~Stephen_Bach1)",Xiaochen,Li,Session 09,Dialogue and Interactive Systems 2,Nov 13 (Wed) 16:00-17:30
FIND,2612,Poster,Generation,Calibrating Long-form Generations From Large Language Models,"Yukun Huang(~Yukun_Huang3),Yixin Liu(~Yixin_Liu2),Raghuveer Thirukovalluru(~Raghuveer_Thirukovalluru1),Arman Cohan(~Arman_Cohan1),Bhuwan Dhingra(~Bhuwan_Dhingra1)",Yukun,Huang,Session 11,Generation 2,Nov 14 (Thu) 10:30-12:00
FIND,2613,Not Presenting,,"Train Once, Deploy Anywhere: Matryoshka Representation Learning for Multimodal Recommendation","Yueqi Wang(~Yueqi_Wang2),Zhenrui Yue(~Zhenrui_Yue1),Huimin Zeng(~Huimin_Zeng1),Dong Wang(~Dong_Wang21),Julian McAuley(~Julian_McAuley1)",TBA,TBA,Not Presenting,,
FIND,2614,Not Presenting,,Exploring Quantization for Efficient Pre-Training of Transformer Language Models,"Kamran Chitsaz(~Kamran_Chitsaz1),Quentin Fournier(~Quentin_Fournier1),Goncalo Mordido(~Goncalo_Mordido1),Sarath Chandar(~Sarath_Chandar1)",TBA,TBA,Not Presenting,,
FIND,2618,VPoster,Resources and Evaluation,Multilingual Synopses of Movie Narratives: A Dataset for Story Understanding,"Yidan Sun(~Yidan_Sun1),Jianfei Yu(~Jianfei_Yu1),Boyang Li(~Boyang_Li1)",Boyang,Li,VPoster,,
FIND,2625,Poster,Resources and Evaluation,MVP-Bench: Can Large Vision-Language Models Conduct Multi-level Visual Perception Like Humans?,"Guanzhen Li(~Guanzhen_Li1),Yuxi Xie(~Yuxi_Xie1),Min-Yen Kan(~Min-Yen_Kan1)",Yuxi,Xie,Session 06,Resources and Evaluation 3,Nov 13 (Wed) 10:30-12:00
FIND,2627,Poster,Information Retrieval and Text Mining,Topic Modeling: Contextual Token Embeddings Are All You Need,"Dimo Angelov(~Dimo_Angelov1),Diana Inkpen(~Diana_Inkpen1)",Dimo,Angelov,Session 09,Information Retrieval and Text Mining 3,Nov 13 (Wed) 16:00-17:30
FIND,2629,Poster,Information Retrieval and Text Mining,Dense Passage Retrieval: Is it Retrieving?,"Benjamin Reichman(~Benjamin_Reichman1),Larry Heck(~Larry_Heck2)",Benjamin,Reichman,Session 09,Information Retrieval and Text Mining 3,Nov 13 (Wed) 16:00-17:30
FIND,263,Not Presenting,,Dynamic Planning for LLM-based Graphical User Interface Automation,"Shaoqing Zhang(~Shaoqing_Zhang2),Zhuosheng Zhang(~Zhuosheng_Zhang1),Kehai Chen(~Kehai_Chen2),Xinbei Ma(~Xinbei_Ma1),Muyun Yang(~Muyun_Yang1),Tiejun Zhao(~Tiejun_Zhao1),Min Zhang(~Min_Zhang9)",Zhang,Shaoqing,Not Presenting,,
