Type,Paper ID,Oral / Poster,Track Theme,Title,Authors Names,Presenter first name,Presenter last name,Session,Sub-session,Session Time
Main,2616,Poster,Summarization,SYNFAC-EDIT: Synthetic Imitation Edit Feedback for Factual Alignment in Clinical Summarization,"Prakamya Mishra(~Prakamya_Mishra1),Zonghai Yao(~Zonghai_Yao1),Parth Vashisht(~Parth_Vashisht1),Feiyun Ouyang(~Feiyun_Ouyang1),Beining Wang(~Beining_Wang1),Vidhi Dhaval Mody(~Vidhi_Dhaval_Mody1),hong yu(~hong_yu1)",Zonghai,Yao,Session 04,Summarization,Nov 12 (Tue) 16:00-17:30
Main,2620,Poster,Machine Learning for NLP,Defending Jailbreak Prompts via In-Context Adversarial Game,"Yujun Zhou(~Yujun_Zhou1),Yufei Han(~Yufei_Han1),Haomin Zhuang(~Haomin_Zhuang1),Kehan Guo(~Kehan_Guo1),Zhenwen Liang(~Zhenwen_Liang1),Hongyan Bao(~Hongyan_Bao1),Xiangliang Zhang(~Xiangliang_Zhang1)",Yujun,Zhou,Session 03,Machine Learning for NLP 1,Nov 12 (Tue) 14:00-15:30
Main,2621,VPoster,Computational Social Science and Cultural Analytics,Detecting Online Community Practices with Large Language Models: A Case Study of Pro-Ukrainian Publics on Twitter,"Kateryna Kasianenko(~Kateryna_Kasianenko1),Shima Khanehzar(~Shima_Khanehzar1),Stephen Wan(~Stephen_Wan1),Ehsan Dehghan(~Ehsan_Dehghan2),Axel Bruns(~Axel_Bruns1)",Kasianenko,Kateryna,VPoster,,
Main,2624,Poster,Multilinguality and Language Diversity,Multilingual Topic Classification in X: Dataset and Analysis,"Dimosthenis Antypas(~Dimosthenis_Antypas1),Asahi Ushio(~Asahi_Ushio1),Francesco Barbieri(~Francesco_Barbieri1),Jose Camacho-Collados(~Jose_Camacho-Collados1)",Dimosthenis,Antypas,Session 03,Multilinguality and Language Diversity 1,Nov 12 (Tue) 14:00-15:30
Main,2628,Poster,Resources and Evaluation,MT-Eval: A Multi-Turn Capabilities Evaluation Benchmark for Large Language Models,"Wai-Chung Kwan(~Wai-Chung_Kwan2),Xingshan Zeng(~Xingshan_Zeng1),Yuxin Jiang(~Yuxin_Jiang1),Yufei Wang(~Yufei_Wang7),Liangyou Li(~Liangyou_Li1),Lifeng Shang(~Lifeng_Shang1),Xin Jiang(~Xin_Jiang1),Qun Liu(~Qun_Liu1),Kam-Fai Wong(~Kam-Fai_Wong2)",Wai-Chung,Kwan,Session 11,Resources and Evaluation 5,Nov 14 (Thu) 10:30-12:00
Main,2630,Poster,Human-centered NLP,Updating CLIP to Prefer Descriptions Over Captions,"Amir Zur(~Amir_Zur1),Elisa Kreiss(~Elisa_Kreiss1),Karel D'Oosterlinck(~Karel_D'Oosterlinck1),Christopher Potts(~Christopher_Potts1),Atticus Geiger(~Atticus_Geiger1)",Amir,Zur,Session 06,Human-centered NLP 2,Nov 13 (Wed) 10:30-12:00
Main,2636,Poster,Resources and Evaluation,CmdCaliper: A Semantic-Aware Command-Line Embedding Model and Dataset for Security Research,"Sian-Yao Huang(~Sian-Yao_Huang2),Cheng-Lin Yang(~Cheng-Lin_Yang2),Che-Yu Lin(~Che-Yu_Lin1),Chun-Ying Huang(~Chun-Ying_Huang1)",SianYao,Huang,Session 11,Resources and Evaluation 5,Nov 14 (Thu) 10:30-12:00
Main,2638,Poster,Machine Translation,Back to School: Translation Using Grammar Books,"Jonathan Hus(~Jonathan_Hus1),Antonios Anastasopoulos(~Antonios_Anastasopoulos1)",TBA,TBA,Session 04,Machine Translation 2,Nov 12 (Tue) 16:00-17:30
Main,2640,Poster,"Multimodality and Language Grounding to Vision, Robotics and Beyond",VIEWS: Entity-Aware News Video Captioning,"Hammad Ayyubi(~Hammad_Ayyubi1),Tianqi Liu(~Tianqi_Liu1),Arsha Nagrani(~Arsha_Nagrani2),Xudong Lin(~Xudong_Lin1),Mingda Zhang(~Mingda_Zhang1),Anurag Arnab(~Anurag_Arnab1),feng han(~feng_han3),Yukun Zhu(~Yukun_Zhu1),Xuande Feng(~Xuande_Feng1),Kevin Zhang(~Kevin_Zhang8),Jialu Liu(~Jialu_Liu1),Shih-Fu Chang(~Shih-Fu_Chang3)",Hammad,Ayyubi,Session 12,"Multimodality and Language Grounding to Vision, Robotics and Beyond 5",Nov 14 (Thu) 14:00-15:30
Main,2643,Poster,Machine Learning for NLP,Towards Aligning Language Models with Textual Feedback,"Saüc Abadal Lloret(~Saüc_Abadal_Lloret1),Shehzaad Dhuliawala(~Shehzaad_Dhuliawala1),Keerthiram Murugesan(~Keerthiram_Murugesan1),Mrinmaya Sachan(~Mrinmaya_Sachan3)",Shehzaad,Dhuliawala,Session 03,Machine Learning for NLP 1,Nov 12 (Tue) 14:00-15:30
Main,2647,Poster,Language Modeling,ATPO: Automatic Tree-Structured Prompt Optimization,"Sheng Yang(~Sheng_Yang7),Yurong Wu(~Yurong_Wu2),Yan Gao(~Yan_Gao7),Zineng Zhou(~Zineng_Zhou1),Xiaodi Sun(~Xiaodi_Sun2),Bin Benjamin Zhu(~Bin_Benjamin_Zhu1),Jian-Guang Lou(~Jian-Guang_Lou1),Zhiming Ding(~Zhiming_Ding1),Anbang Hu(~Anbang_Hu1),Yuan Fang(~Yuan_Fang4),Yunsong Li(~Yunsong_Li5),Junyan Chen(~Junyan_Chen2),Linjun Yang(~Linjun_Yang2)",Yurong,Wu,Session 09,Language Modeling 3,Nov 13 (Wed) 16:00-17:30
Main,2649,VPoster,Machine Translation,DeMPT: Decoding-enhanced Multi-phase Prompt Tuning for Making LLMs Be Better Context-aware Translators,"Xinglin Lyu(~Xinglin_Lyu1),Junhui Li(~Junhui_Li2),Yanqing Zhao(~Yanqing_Zhao1),Min Zhang(~Min_Zhang10),Daimeng Wei(~Daimeng_Wei1),shimin tao(~shimin_tao1),Hao Yang(~Hao_Yang7),Min Zhang(~Min_Zhang9)",Xinglin,Lyu,VPoster,,
Main,2650,Poster,Low-resource Methods for NLP,DEFT-UCS: Data Efficient Fine-Tuning for Pre-Trained Language Models via Unsupervised Core-Set Selection,"Devleena Das(~Devleena_Das1),Vivek Khetan(~Vivek_Khetan1)",TBA,TBA,Session 06,Low-resource Methods for NLP 2,Nov 13 (Wed) 10:30-12:00
Main,2655,Poster,"Linguistic Theories, Cognitive Modeling and Psycholinguistics",Unveiling Multi-level and Multi-modal Semantic Representations in the Human Brain using Large Language Models,"Yuko Nakagi(~Yuko_Nakagi1),Takuya Matsuyama(~Takuya_Matsuyama1),Naoko Koide-Majima(~Naoko_Koide-Majima1),Hiroto Q. Yamaguchi(~Hiroto_Q._Yamaguchi1),Rieko Kubo(~Rieko_Kubo1),Shinji Nishimoto(~Shinji_Nishimoto1),Yu Takagi(~Yu_Takagi1)",Yuko,Nakagi,Session 02,"Linguistic Theories, Cognitive Modeling and Psycholinguistics 1",Nov 12 (Tue) 11:00-12:30
Main,2657,Oral,Computational Social Science and Cultural Analytics,"""They are uncultured"": Unveiling Covert Harms and Social Threats in LLM Generated Conversations","Preetam Prabhu Srikar Dammu(~Preetam_Prabhu_Srikar_Dammu2),Hayoung Jung(~Hayoung_Jung1),Anjali Singh(~Anjali_Singh3),Monojit Choudhury(~Monojit_Choudhury1),Tanu Mitra(~Tanu_Mitra1)",Preetam,Dammu,Session 11,Computational Social Science and Cultural Analytics 3,Nov 14 (Thu) 10:30-12:00
Main,2658,Poster,"Special Theme: Efficiency in Model Algorithms, Training, and Inference","Multi-expert Prompting Improves Reliability, Safety and Usefulness of Large Language Models","Do Xuan Long(~Do_Xuan_Long1),Duong Ngoc Yen(~Duong_Ngoc_Yen1),Anh Tuan Luu(~Anh_Tuan_Luu2),Kenji Kawaguchi(~Kenji_Kawaguchi1),Min-Yen Kan(~Min-Yen_Kan1),Nancy F. Chen(~Nancy_F._Chen1)",TBA,TBA,Session 11,"Special Theme: Efficiency in Model Algorithms, Training, and Inference 3",Nov 14 (Thu) 10:30-12:00
Main,2662,Poster,Discourse and Pragmatics,Will LLMs Replace the Encoder-Only Models in Temporal Relation Classification?,"Gabriel Roccabruna(~Gabriel_Roccabruna1),Massimo Rizzoli(~Massimo_Rizzoli1),giuseppe riccardi(~giuseppe_riccardi1)",Gabriel,Roccabruna,Session 03,Discourse + Phonology + Syntax 1,Nov 12 (Tue) 14:00-15:30
Main,2669,Poster,"Multimodality and Language Grounding to Vision, Robotics and Beyond",Eliciting In-Context Learning in Vision-Language Models for Videos Through Curated Data Distributional Properties,"Keunwoo Peter Yu(~Keunwoo_Peter_Yu1),Zheyuan Zhang(~Zheyuan_Zhang4),Fengyuan Hu(~Fengyuan_Hu2),Shane Storks(~Shane_Storks1),Joyce Chai(~Joyce_Chai2)",Keunwoo Peter,Yu,Session 12,"Multimodality and Language Grounding to Vision, Robotics and Beyond 5",Nov 14 (Thu) 14:00-15:30
Main,2672,Poster,NLP Applications,Framework for Robust and Scalable Text Watermarking,"Gregory Kang Ruey Lau(~Gregory_Kang_Ruey_Lau1),Xinyuan Niu(~Xinyuan_Niu1),Hieu Dao(~Hieu_Dao1),Jiangwei Chen(~Jiangwei_Chen2),Chuan-Sheng Foo(~Chuan-Sheng_Foo1),Bryan Kian Hsiang Low(~Bryan_Kian_Hsiang_Low1)",Gregory Kang Ruey,Lau,Session 02,NLP Applications 1,Nov 12 (Tue) 11:00-12:30
Main,2677,Oral,Computational Social Science and Cultural Analytics,MASIVE: Open-Ended Affective State Identification in English and Spanish,"Nicholas Deas(~Nicholas_Deas1),Elsbeth Turcan(~Elsbeth_Turcan1),Ivan Ernesto Perez Mejia(~Ivan_Ernesto_Perez_Mejia1),Kathleen McKeown(~Kathleen_McKeown1)",Nicholas,Deas,Session 11,Computational Social Science and Cultural Analytics 3,Nov 14 (Thu) 10:30-12:00
Main,2678,Poster,Question Answering,You Make me Feel like a Natural Question: Training QA Systems on Transformed Trivia Questions,"Tasnim Kabir(~Tasnim_Kabir2),Yoo Yeon Sung(~Yoo_Yeon_Sung1),Saptarashmi Bandyopadhyay(~Saptarashmi_Bandyopadhyay1),Hao Zou(~Hao_Zou4),Abhranil Chandra(~Abhranil_Chandra1),Jordan Lee Boyd-Graber(~Jordan_Lee_Boyd-Graber1)",Tasnim,Kabir,Session 09,Question Answering 3,Nov 13 (Wed) 16:00-17:30
Main,2683,Poster,Language Modeling,AlphaExpert: Assigning LoRA Experts Based on Layer Training Quality,"Peijun Qing(~Peijun_Qing2),Chongyang Gao(~Chongyang_Gao1),Yefan Zhou(~Yefan_Zhou1),Xingjian Diao(~Xingjian_Diao1),Yaoqing Yang(~Yaoqing_Yang1),Soroush Vosoughi(~Soroush_Vosoughi1)",Peijun,Qing,Session 09,Language Modeling 3,Nov 13 (Wed) 16:00-17:30
Main,2686,Poster,"Sentiment Analysis, Stylistic Analysis, and Argument Mining",Flee the Flaw: Annotating the Underlying Logic of Fallacious Arguments Through Templates and Slot-filling,"Irfan Robbani(~Irfan_Robbani1),Paul Reisert(~Paul_Reisert1),Surawat Pothong(~Surawat_Pothong1),Naoya Inoue(~Naoya_Inoue1),Camélia Guerraoui(~Camélia_Guerraoui1),Wenzhi Wang(~Wenzhi_Wang1),Shoichi Naito(~Shoichi_Naito1),Jungmin Choi(~Jungmin_Choi1),Kentaro Inui(~Kentaro_Inui1)",Irfan,Robbani,Session 04,"Sentiment Analysis, Stylistic Analysis, and Argument Mining",Nov 12 (Tue) 16:00-17:30
Main,2703,Poster,"Multimodality and Language Grounding to Vision, Robotics and Beyond",Advancing Social Intelligence in AI Agents: Technical Challenges and Open Question,"Leena Mathur(~Leena_Mathur1),Paul Pu Liang(~Paul_Pu_Liang1),Louis-Philippe Morency(~Louis-Philippe_Morency1)",Leena,Mathur,Session 09,"Multimodality and Language Grounding to Vision, Robotics and Beyond 4",Nov 13 (Wed) 16:00-17:30
Main,2712,VPoster,"Multimodality and Language Grounding to Vision, Robotics and Beyond",RAt: Injecting Implicit Bias for Text-To-Image Prompt Refinement Models,"Ziyi Kou(~Ziyi_Kou1),Shichao Pei(~Shichao_Pei1),Meng Jiang(~Meng_Jiang3),Xiangliang Zhang(~Xiangliang_Zhang1)",Ziyi,Kou,VPoster,,
Main,2715,Poster,Resources and Evaluation,Can LLM Generate Culturally Relevant Commonsense QA Data? Case Study in Indonesian and Sundanese,"Rifki Afina Putri(~Rifki_Afina_Putri1),Faiz Ghifari Haznitrama(~Faiz_Ghifari_Haznitrama1),Dea Adhista(~Dea_Adhista1),Alice Oh(~Alice_Oh1)",Rifki Afina,Putri,Session 04,Resources and Evaluation 2,Nov 12 (Tue) 16:00-17:30
Main,2717,Oral,"Linguistic Theories, Cognitive Modeling and Psycholinguistics",Learnability of Indirect Evidence in Language Models,"Miyu Oba(~Miyu_Oba1),Yohei Oseki(~Yohei_Oseki1),Akiyo Fukatsu(~Akiyo_Fukatsu2),Akari Haga(~Akari_Haga1),Hiroki Ouchi(~Hiroki_Ouchi2),Taro Watanabe(~Taro_Watanabe1),Saku Sugawara(~Saku_Sugawara1)",Miyu,Oba,Session 04,"Linguistic Theories, Cognitive Modeling and Psycholinguistics 2",Nov 12 (Tue) 16:00-17:30
Main,2725,Poster,NLP Applications,Do LLMs Know to Respect Copyright Notice?,"Jialiang Xu(~Jialiang_Xu1),SHENGLAN LI(~SHENGLAN_LI1),Zhaozhuo Xu(~Zhaozhuo_Xu1),Denghui Zhang(~Denghui_Zhang2)",Denghui,Zhang,Session 12,NLP Applications 5,Nov 14 (Thu) 14:00-15:30
Main,2727,Poster,"Special Theme: Efficiency in Model Algorithms, Training, and Inference",SpecHub: Provable Acceleration to Multi-Draft Speculative Decoding,"Hanchi Sun(~Hanchi_Sun2),Tianyi Zhou(~Tianyi_Zhou1),Xun Chen(~Xun_Chen1),Lichao Sun(~Lichao_Sun1)",Hanchi,Sun,Session 04,"Special Theme: Efficiency in Model Algorithms, Training, and Inference 2",Nov 12 (Tue) 16:00-17:30
Main,2736,Oral,Speech Processing and Spoken Language Understanding,Interventional Speech Noise Injection for ASR Generalizable Spoken Language Understanding,"YeonJoon Jung(~YeonJoon_Jung1),Jaeseong Lee(~Jaeseong_Lee1),Seungtaek Choi(~Seungtaek_Choi1),Dohyeon Lee(~Dohyeon_Lee1),Minsoo Kim(~Minsoo_Kim1),seung-won hwang(~seung-won_hwang2)",Yeonjoon,Jung,Session 12,Speech Processing and Spoken Language Understanding 2,Nov 14 (Thu) 14:00-15:30
Main,2737,Poster,Language Modeling,Rethinking the Role of Proxy Rewards in Language Model Alignment,"Sungdong Kim(~Sungdong_Kim1),Minjoon Seo(~Minjoon_Seo1)",Sungdong,Kim,Session 09,Language Modeling 3,Nov 13 (Wed) 16:00-17:30
Main,2741,Poster,"Multimodality and Language Grounding to Vision, Robotics and Beyond",Visual Text Matters: Improving Text-KVQA with Visual Text Entity Knowledge-aware Large Multimodal Assistant,"Abhirama Subramanyam Penamakuri(~Abhirama_Subramanyam_Penamakuri1),Anand Mishra(~Anand_Mishra2)",Abhirama Subramanyam,Penamakuri,Session 02,"Multimodality and Language Grounding to Vision, Robotics and Beyond 1",Nov 12 (Tue) 11:00-12:30
Main,2746,Poster,Machine Translation,How Good is my MT Metric? A Framework for the Interpretation of Metric Assessments,"Stefano Perrella(~Stefano_Perrella1),Lorenzo Proietti(~Lorenzo_Proietti1),Pere-Lluís Huguet Cabot(~Pere-Lluís_Huguet_Cabot1),Edoardo Barba(~Edoardo_Barba1),Roberto Navigli(~Roberto_Navigli2)",Stefano,Perrella,Session 04,Machine Translation 2,Nov 12 (Tue) 16:00-17:30
Main,2749,Poster,"Multimodality and Language Grounding to Vision, Robotics and Beyond",IFCap: Image-like Retrieval and Frequency-based Entity Filtering for Zero-shot Captioning,"Soeun Lee(~Soeun_Lee1),Si-Woo Kim(~Si-Woo_Kim1),Taewhan Kim(~Taewhan_Kim2),Dong-Jin Kim(~Dong-Jin_Kim1)",Soeun,Lee,Session 02,"Multimodality and Language Grounding to Vision, Robotics and Beyond 1",Nov 12 (Tue) 11:00-12:30
Main,2752,Poster,Information Retrieval and Text Mining,SPREADSHEETLLM: Encoding Spreadsheets for Large Language Models,"Haoyu Dong(~Haoyu_Dong2),Jianbo Zhao(~Jianbo_Zhao3),Yuzhang Tian(~Yuzhang_Tian1),Junyu Xiong(~Junyu_Xiong2),Shiyu Xia(~Shiyu_Xia3),Mengyu Zhou(~Mengyu_Zhou1),Yun Lin(~Yun_Lin3),José Cambronero(~José_Cambronero1),Yeye He(~Yeye_He1),Shi Han(~Shi_Han1),Dongmei Zhang(~Dongmei_Zhang2)",Haoyu,Dong,Session 02,Information Retrieval and Text Mining 1,Nov 12 (Tue) 11:00-12:30
Main,2754,Poster,"Sentiment Analysis, Stylistic Analysis, and Argument Mining",Let’s discuss! Quality Dimensions and Annotated Datasets for Computational Argument Quality,"Rositsa V Ivanova(~Rositsa_V_Ivanova1),Thomas Huber(~Thomas_Huber3),Christina Niklaus(~Christina_Niklaus1)",Rositsa V,Ivanova,Session 04,"Sentiment Analysis, Stylistic Analysis, and Argument Mining",Nov 12 (Tue) 16:00-17:30
Main,2755,Poster,"Syntax: Tagging, Chunking and Parsing",Automatic sentence segmentation of clinical record narratives in real-world data,"Dongfang Xu(~Dongfang_Xu1),Davy Weissenbacher(~Davy_Weissenbacher1),Karen O'Connor(~Karen_O'Connor1),Siddharth Rawal(~Siddharth_Rawal1),Graciela Gonzalez Hernandez(~Graciela_Gonzalez_Hernandez1)",Dongfang,Xu,Session 03,Discourse + Phonology + Syntax 1,Nov 12 (Tue) 14:00-15:30
Main,2761,VPoster,Machine Learning for NLP,One-to-Many Communication and Compositionality in Emergent Communication,Heeyoung Lee(~Heeyoung_Lee2),Heeyoung,Lee,VPoster,,
Main,2762,Poster,"Multimodality and Language Grounding to Vision, Robotics and Beyond","Bayesian Example Selection Improves In-Context Learning for Speech, Text, and Visual Modalities","Siyin Wang(~Siyin_Wang2),Chao-Han Huck Yang(~Chao-Han_Huck_Yang1),Ji Wu(~Ji_Wu3),Chao Zhang(~Chao_Zhang20)",Siyin,Wang,Session 02,"Multimodality and Language Grounding to Vision, Robotics and Beyond 1",Nov 12 (Tue) 11:00-12:30
Main,2764,Poster,Multilinguality and Language Diversity,Investigating Multilingual Instruction-Tuning: Do Polyglot Models Demand for Multilingual Instructions?,"Alexander Arno Weber(~Alexander_Arno_Weber1),Klaudia Thellmann(~Klaudia_Thellmann1),Jan Ebert(~Jan_Ebert1),Nicolas Flores-Herr(~Nicolas_Flores-Herr1),Jens Lehmann(~Jens_Lehmann3),Michael Fromm(~Michael_Fromm2),Mehdi Ali(~Mehdi_Ali1)",Alexander,Weber,Session 03,Multilinguality and Language Diversity 1,Nov 12 (Tue) 14:00-15:30
Main,2768,Poster,Resources and Evaluation,Multi-LogiEval: Towards Evaluating Multi-Step Logical Reasoning Ability of Large Language Models,"Nisarg Patel(~Nisarg_Patel1),Mohith Kulkarni(~Mohith_Kulkarni1),Mihir Parmar(~Mihir_Parmar1),Aashna Budhiraja(~Aashna_Budhiraja1),Mutsumi Nakamura(~Mutsumi_Nakamura1),Neeraj Varshney(~Neeraj_Varshney1),Chitta Baral(~Chitta_Baral1)",TBA,TBA,Session 11,Resources and Evaluation 5,Nov 14 (Thu) 10:30-12:00
Main,2771,Poster,"Sentiment Analysis, Stylistic Analysis, and Argument Mining",Contrastive Classification via Linear Layer Extrapolation,"Mayukh Sharma(~Mayukh_Sharma1),Sean O'Brien(~Sean_O'Brien1),Julian McAuley(~Julian_McAuley1)",Mayukh,Sharma,Session 04,"Sentiment Analysis, Stylistic Analysis, and Argument Mining",Nov 12 (Tue) 16:00-17:30
Main,2775,Poster,NLP Applications,Task Oriented In-Domain Data Augmentation,"Xiao Liang(~Xiao_Liang9),Xinyu Hu(~Xinyu_Hu2),Simiao Zuo(~Simiao_Zuo1),Yeyun Gong(~Yeyun_Gong2),Qiang Lou(~Qiang_Lou1),Yi Liu(~Yi_Liu20),Shao-Lun Huang(~Shao-Lun_Huang3),Jian Jiao(~Jian_Jiao2)",Xiao,Liang,Session 06,NLP Applications 2,Nov 13 (Wed) 10:30-12:00
Main,2782,Poster,Resources and Evaluation,SciDQA: A Deep Reading Comprehension Dataset over Scientific Papers,"Shruti Singh(~Shruti_Singh2),Nandan Sarkar(~Nandan_Sarkar1),Arman Cohan(~Arman_Cohan1)",Shruti,Singh,Session 04,Resources and Evaluation 2,Nov 12 (Tue) 16:00-17:30
Main,2788,Poster,Language Modeling,Mixture-of-Modules: Reinventing Transformers as Dynamic Assemblies of Modules,"Zhuocheng Gong(~Zhuocheng_Gong1),Ang Lv(~Ang_Lv1),Jian Guan(~Jian_Guan1),Wei Wu(~Wei_Wu1),Huishuai Zhang(~Huishuai_Zhang3),Minlie Huang(~Minlie_Huang1),Dongyan Zhao(~Dongyan_Zhao2),Rui Yan(~Rui_Yan2)",Zhuocheng,Gong,Session 09,Language Modeling 3,Nov 13 (Wed) 16:00-17:30
Main,2806,Poster,Resources and Evaluation,"No Culture Left Behind: ArtELingo-28, a Benchmark of WikiArt with Captions in 28 Languages","Youssef Mohamed(~Youssef_Mohamed1),Runjia Li(~Runjia_Li1),Ibrahim Said Ahmad(~Ibrahim_Said_Ahmad1),Kilichbek Haydarov(~Kilichbek_Haydarov2),Philip Torr(~Philip_Torr1),Kenneth Church(~Kenneth_Church1),Mohamed Elhoseiny(~Mohamed_Elhoseiny1)",Youssef Sherif Mansour,Mohamed,Session 11,Resources and Evaluation 5,Nov 14 (Thu) 10:30-12:00
Main,2809,Oral,NLP Applications,PREDICT: Multi-Agent-based Debate Simulation for Generalized Hate Speech Detection,"Someen Park(~Someen_Park1),Jaehoon Kim(~Jaehoon_Kim3),Seungwan Jin(~Seungwan_Jin2),Sohyun Park(~Sohyun_Park1),Kyungsik Han(~Kyungsik_Han1)",Someen,Park,Session 11,NLP Applications 4,Nov 14 (Thu) 10:30-12:00
Main,2811,Poster,Speech Processing and Spoken Language Understanding,TokenVerse: Unifying Speech and NLP Tasks via Transducer-based ASR,"Shashi Kumar(~Shashi_Kumar1),Srikanth Madikeri(~Srikanth_Madikeri1),Juan Pablo Zuluaga Gomez(~Juan_Pablo_Zuluaga_Gomez1),Iuliia Thorbecke(~Iuliia_Thorbecke1),Esaú VILLATORO-TELLO(~Esaú_VILLATORO-TELLO1),Sergio Burdisso(~Sergio_Burdisso1),Petr Motlicek(~Petr_Motlicek1),Karthik Pandia D S(~Karthik_Pandia_D_S1),Aravind Ganapathiraju(~Aravind_Ganapathiraju1)",Shashi,Kumar,Session 06,Speech Processing and Spoken Language Understanding 1,Nov 13 (Wed) 10:30-12:00
Main,2812,Poster,"Special Theme: Efficiency in Model Algorithms, Training, and Inference",ApiQ: Finetuning of 2-Bit Quantized Large Language Model,"Baohao Liao(~Baohao_Liao1),Christian Herold(~Christian_Herold1),Shahram Khadivi(~Shahram_Khadivi1),Christof Monz(~Christof_Monz1)",Baohao,Liao,Session 04,"Special Theme: Efficiency in Model Algorithms, Training, and Inference 2",Nov 12 (Tue) 16:00-17:30
Main,2817,Poster,"Special Theme: Efficiency in Model Algorithms, Training, and Inference",Memorize Step by Step: Efficient Long-Context Prefilling with Incremental Memory and Decremental Chunk,"Zhiyuan Zeng(~Zhiyuan_Zeng4),Qipeng Guo(~Qipeng_Guo1),Xiaoran Liu(~Xiaoran_Liu1),Zhangyue Yin(~Zhangyue_Yin1),Wentao Shu(~Wentao_Shu1),Mianqiu Huang(~Mianqiu_Huang1),Bo Wang(~Bo_Wang38),Yunhua Zhou(~Yunhua_Zhou1),Linlin Li(~Linlin_Li3),Qun Liu(~Qun_Liu1),Xipeng Qiu(~Xipeng_Qiu1)",TBA,TBA,Session 11,"Special Theme: Efficiency in Model Algorithms, Training, and Inference 3",Nov 14 (Thu) 10:30-12:00
Main,2819,Poster,Interpretability and Analysis of Models for NLP,A Morphology-Based Investigation of Positional Encodings,"Poulami Ghosh(~Poulami_Ghosh2),Shikhar Vashishth(~Shikhar_Vashishth1),Raj Dabre(~Raj_Dabre1),Pushpak Bhattacharyya(~Pushpak_Bhattacharyya1)",Poulami,Ghosh,Session 06,Interpretability and Analysis of Models for NLP 3,Nov 13 (Wed) 10:30-12:00
Main,2821,VPoster,Computational Social Science and Cultural Analytics,I love pineapple on pizza != I hate pineapple on pizza: Stance-Aware Sentence Transformers for Opinion Mining,"Vahid Ghafouri(~Vahid_Ghafouri1),Jose M. Such(~Jose_M._Such1),Guillermo Suarez-Tangil(~Guillermo_Suarez-Tangil1)",Vahid,Ghafouri,VPoster,,
Main,2827,Oral,"Ethics, Bias, and Fairness",BiasWipe: Mitigating Unintended Bias in Text Classifiers through Model Interpretability,"Mamta Mamta(~Mamta_Mamta1),Rishikant Chigrupaatii(~Rishikant_Chigrupaatii1),Asif Ekbal(~Asif_Ekbal1)",Mamta,Mamta,Session 06,"Ethics, Bias, and Fairness 3",Nov 13 (Wed) 10:30-12:00
Main,2831,Poster,Resources and Evaluation,ArMeme: Propagandistic Content in Arabic Memes,"Firoj Alam(~Firoj_Alam1),Abul Hasnat(~Abul_Hasnat1),Fatema Ahmad(~Fatema_Ahmad1),Md. Arid Hasan(~Md._Arid_Hasan1),Maram Hasanain(~Maram_Hasanain1)",Firoj,Alam,Session 04,Resources and Evaluation 2,Nov 12 (Tue) 16:00-17:30
Main,2832,Poster,Computational Social Science and Cultural Analytics,Language is Scary when Over-Analyzed: Unpacking Implied Misogynistic Reasoning with Argumentation Theory-Driven Prompts,"Arianna Muti(~Arianna_Muti1),Federico Ruggeri(~Federico_Ruggeri1),Khalid Al Khatib(~Khalid_Al_Khatib1),Alberto Barrón-Cedeño(~Alberto_Barrón-Cedeño1),Tommaso Caselli(~Tommaso_Caselli1)",Arianna,Muti,Session 12,Computational Social Science and Cultural Analytics 4,Nov 14 (Thu) 14:00-15:30
Main,2842,VPoster,Dialogue and Interactive Systems,Thoughts to Target: Enhance Planning for Target-driven Conversation,"Zhonghua Zheng(~Zhonghua_Zheng2),Lizi Liao(~Lizi_Liao1),Yang Deng(~Yang_Deng4),Ee-Peng Lim(~Ee-Peng_Lim1),Minlie Huang(~Minlie_Huang1),Liqiang Nie(~Liqiang_Nie2)",Zhonghua,Zheng,VPoster,,
Main,2843,Poster,"Special Theme: Efficiency in Model Algorithms, Training, and Inference",Scalable Data Ablation Approximations for Language Models through Modular Training and Merging,"Clara Na(~Clara_Na1),Ian Magnusson(~Ian_Magnusson1),Ananya Harsh Jha(~Ananya_Harsh_Jha2),Tom Sherborne(~Tom_Sherborne2),Emma Strubell(~Emma_Strubell1),Jesse Dodge(~Jesse_Dodge1),Pradeep Dasigi(~Pradeep_Dasigi1)",Clara,Na,Session 11,"Special Theme: Efficiency in Model Algorithms, Training, and Inference 3",Nov 14 (Thu) 10:30-12:00
Main,2847,Poster,Machine Translation,Exploring Intrinsic Language-specific Subspaces in Fine-tuning Multilingual Neural Machine Translation,"Zhe Cao(~Zhe_Cao5),Zhi Qu(~Zhi_Qu2),Hidetaka Kamigaito(~Hidetaka_Kamigaito2),Taro Watanabe(~Taro_Watanabe1)",Zhe,Cao,Session 04,Machine Translation 2,Nov 12 (Tue) 16:00-17:30
Main,2854,Poster,"Special Theme: Efficiency in Model Algorithms, Training, and Inference",Attention Score is not All You Need for Token Importance Indicator in KV Cache Reduction: Value Also Matters,"Zhiyu Guo(~Zhiyu_Guo1),Hidetaka Kamigaito(~Hidetaka_Kamigaito2),Taro Watanabe(~Taro_Watanabe1)",Hidetaka,Kamigaito,Session 11,"Special Theme: Efficiency in Model Algorithms, Training, and Inference 3",Nov 14 (Thu) 10:30-12:00
Main,2859,Poster,Dialogue and Interactive Systems,Generative Subgraph Retrieval for Knowledge Graph–Grounded Dialog Generation,"Jinyoung Park(~Jinyoung_Park1),Minseok Joo(~Minseok_Joo1),Joo-Kyung Kim(~Joo-Kyung_Kim1),Hyunwoo J. Kim(~Hyunwoo_J._Kim3)",Jinyoung,Park,Session 09,Dialogue and Interactive Systems 2,Nov 13 (Wed) 16:00-17:30
Main,2860,Oral,Interpretability and Analysis of Models for NLP,Adapters Mixup: Mixing Parameter-Efficient Adapters to Enhance the Adversarial Robustness of Fine-tuned Pre-trained Text Classifiers,"Tuc Van Nguyen(~Tuc_Van_Nguyen1),Thai Le(~Thai_Le1)",Tuc Nguyen,Thai Le,Session 02,Interpretability and Analysis of Models for NLP 1,Nov 12 (Tue) 11:00-12:30
Main,2861,Poster,NLP Applications,Generalizing Clinical De-identification Models by Privacy-safe Data Augmentation using GPT-4,"Woojin Kim(~Woojin_Kim2),Sungeun Hahm(~Sungeun_Hahm1),Jaejin Lee(~Jaejin_Lee1)",Woojin,Kim,Session 06,NLP Applications 2,Nov 13 (Wed) 10:30-12:00
Main,2863,Poster,"Semantics: Lexical, Sentence-level Semantics, Textual Inference and Other Areas",Connecting the Dots: Evaluating Abstract Reasoning Capabilities of LLMs Using the New York Times Connections Word Game,"Prisha Samdarshi(~Prisha_Samdarshi1),Mariam Mustafa(~Mariam_Mustafa1),Anushka Kulkarni(~Anushka_Kulkarni1),Raven Rothkopf(~Raven_Rothkopf1),Tuhin Chakrabarty(~Tuhin_Chakrabarty2),Smaranda Muresan(~Smaranda_Muresan1)",Tuhin,Chakrabarty,Session 09,"Semantics: Lexical, Sentence-level Semantics, Textual Inference and Other Areas",Nov 13 (Wed) 16:00-17:30
Main,2870,Poster,Machine Learning for NLP,GottBERT: a pure German Language Model,"Raphael Scheible(~Raphael_Scheible1),Johann Frei(~Johann_Frei1),Fabian Thomczyk(~Fabian_Thomczyk1),Henry He(~Henry_He1),Patric Tippmann(~Patric_Tippmann1),Jochen Knaus(~Jochen_Knaus1),Victor Jaravine(~Victor_Jaravine1),Frank Kramer(~Frank_Kramer1),Martin Boeker(~Martin_Boeker1)",TBA,TBA,Session 03,Machine Learning for NLP 1,Nov 12 (Tue) 14:00-15:30
Main,2885,Poster,NLP Applications,Computational Meme Understanding: A Survey,"Khoi P. N. Nguyen(~Khoi_P._N._Nguyen1),Vincent Ng(~Vincent_Ng1)",Khoi,Nguyen,Session 12,NLP Applications 5,Nov 14 (Thu) 14:00-15:30
